Transaction report 2022

Date,Type,Label,Sending Wallet,Sent Amount,Sent Currency,Sent Cost Basis,Receiving Wallet,Received Amount,Received Currency,Received Cost Basis,Fee Amount,Fee Currency,Gain (USD),Net Value (USD),Fee Value (USD),TxSrc,TxDest,TxHash,Description
2013-01-13 13:49:38 UTC,fiat_withdrawal,"",Coinbase,1467.12,USD,"","","","","","","","",1467.12,"","","","",""
2016-03-06 22:18:17 UTC,buy,"",Coinbase,24.75,USD,"",Coinbase,0.06093808,BTC,25.0,0.25,USD,"",24.75,0.25,"","",e56f69e8-c8c9-51a6-b878-a4c5a58144a2,""
2016-03-06 22:18:17 UTC,fiat_deposit,"","","","","",Coinbase,25.0,USD,"","","","",25.0,"",Wells Fargo - Checking ******2498,"","",Bought Bitcoin Using Wells Fargo - Checking ******2498
2016-03-07 20:00:28 UTC,crypto_deposit,"","","","","",Coinbase,0.0001,BTC,0.04,"","","",0.04,"","","",11432f1717f2cdddff1aa6c8c7992350349304879fa2aad3dc7394bb3352497f,Received Bitcoin From Bitcoin address
2016-03-07 21:46:45 UTC,buy,"",Coinbase,4.85,USD,"",Coinbase,0.01176613,BTC,5.0,0.15,USD,"",4.85,0.15,"","",f2e68bfc-55e9-500c-8106-f757c5d88897,""
2016-03-07 21:46:45 UTC,fiat_deposit,"","","","","",Coinbase,5.0,USD,"","","","",5.0,"",Wells Fargo - Checking ******2498,"","",Bought Bitcoin Using Wells Fargo - Checking ******2498
2016-03-08 04:15:35 UTC,buy,"",Coinbase,4.85,USD,"",Coinbase,0.01171243,BTC,5.0,0.15,USD,"",4.85,0.15,"","",c20b9c97-e7d2-58f5-88ea-2bd06fd2daff,""
2016-03-08 04:15:35 UTC,fiat_deposit,"","","","","",Coinbase,5.0,USD,"","","","",5.0,"",Wells Fargo - Checking ******2498,"","",Bought Bitcoin Using Wells Fargo - Checking ******2498
2016-03-08 19:10:03 UTC,buy,"",Coinbase,9.85,USD,"",Coinbase,0.02395661,BTC,10.0,0.15,USD,"",9.85,0.15,"","",da5c9b14-4171-5d45-a713-467f0d7ff7b9,""
2016-03-08 19:10:03 UTC,fiat_deposit,"","","","","",Coinbase,10.0,USD,"","","","",10.0,"",Wells Fargo - Checking ******2498,"","",Bought Bitcoin Using Wells Fargo - Checking ******2498
2016-03-09 19:59:05 UTC,buy,"",Coinbase,4.85,USD,"",Coinbase,0.01179905,BTC,5.0,0.15,USD,"",4.85,0.15,"","",b176839e-efd0-574d-9157-2fd7ba415478,""
2016-03-09 19:59:05 UTC,fiat_deposit,"","","","","",Coinbase,5.0,USD,"","","","",5.0,"",Wells Fargo - Checking ******2498,"","",Bought Bitcoin Using Wells Fargo - Checking ******2498
2016-03-12 02:14:06 UTC,buy,"",Coinbase,4.85,USD,"",Coinbase,0.01157076,BTC,5.0,0.15,USD,"",4.85,0.15,"","",2fffb28e-fc43-587b-89d4-442e9f96daf2,""
2016-03-12 02:14:06 UTC,fiat_deposit,"","","","","",Coinbase,5.0,USD,"","","","",5.0,"",Wells Fargo - Checking ******2498,"","",Bought Bitcoin Using Wells Fargo - Checking ******2498
2016-04-14 19:24:24 UTC,buy,"",Coinbase,4.85,USD,"",Coinbase,0.01138705,BTC,5.0,0.15,USD,"",4.85,0.15,"","",7c136a83-e97f-5ec3-a3d5-abd4042438b2,""
2016-04-14 19:24:24 UTC,fiat_deposit,"","","","","",Coinbase,5.0,USD,"","","","",5.0,"",Wells Fargo - Checking ******2498,"","",Bought Bitcoin Using Wells Fargo - Checking ******2498
2016-05-13 16:33:21 UTC,fiat_deposit,"","","","","",Coinbase,25.0,USD,"","","","",25.0,"",Wells Fargo - Checking ******2498,"","",Bought Bitcoin Using Wells Fargo - Checking ******2498
2016-05-13 16:33:21 UTC,buy,"",Coinbase,24.75,USD,"",Coinbase,0.0541676,BTC,25.0,0.25,USD,"",24.75,0.25,"","",5c667094-7664-5d1c-bf98-14d4051ebdc7,""
2016-05-18 04:44:46 UTC,fiat_deposit,"","","","","",Coinbase,11.0,USD,"","","","",11.0,"",Wells Fargo - Checking ******2498,"","",Bought Bitcoin Using Wells Fargo - Checking ******2498
2016-05-18 04:44:46 UTC,buy,"",Coinbase,10.85,USD,"",Coinbase,0.02378239,BTC,11.0,0.15,USD,"",10.85,0.15,"","",5fe069fd-b86c-56bc-83ac-9f199269c9b3,""
2016-08-12 13:16:23 UTC,buy,"",Coinbase,10.0,USD,"",Coinbase,0.0169081,BTC,10.15,0.15,USD,"",10.0,0.15,"","",36659ad8-882c-58ee-ac1c-0c47811526bc,""
2016-08-12 13:16:23 UTC,fiat_deposit,"","","","","",Coinbase,10.15,USD,"","","","",10.15,"",Wells Fargo - Checking ******2498,"","",Bought Bitcoin Using Wells Fargo - Checking ******2498
2016-08-12 13:21:43 UTC,crypto_deposit,"","","","","",Coinbase,0.01699,BTC,10.0,"","","",10.0,"",Coinbase,"","","Congrats! You just earned a $10 bonus for accepting your friend 99 Bitcoins's Coinbase invite! They also got $10 of bitcoin for telling you about Coinbase. 

Find out more on the https://www.coinbase.com/invite_friends page."
2016-08-29 10:32:39 UTC,crypto_deposit,"","","","","",Binance (Archived),0.00010412,BTC,0.0609811094,"","","",0.0609811094,"","","","",Long term BTC disposal from tax lot of 0.025611210000000 BTC acquired on 8/29/2016 2:32:39 PM via Buy.
2016-08-29 14:32:39 UTC,buy,"",Coinbase,14.78,USD,"",Coinbase,0.02561121,BTC,15.0,0.22,USD,"",14.78,0.22,"","",c6b17152-fd36-5ffa-a358-693754e99f20,""
2016-08-29 14:32:39 UTC,fiat_deposit,"","","","","",Coinbase,15.0,USD,"","","","",15.0,"",Wells Fargo - Checking ******2498,"","",Bought Bitcoin Using Wells Fargo - Checking ******2498
2016-08-30 21:06:45 UTC,buy,"",Coinbase,11.27,USD,"",Coinbase,1.0,ETH,11.44,0.17,USD,"",11.27,0.17,"","",64e32098-5797-5953-982a-4a2da60471d3,""
2016-08-30 21:06:45 UTC,fiat_deposit,"","","","","",Coinbase,11.44,USD,"","","","",11.44,"",Wells Fargo - Checking ******2498,"","",Bought Ethereum Using Wells Fargo - Checking ******2498
2016-08-30 22:02:37 UTC,crypto_withdrawal,"",Coinbase,0.0001,BTC,0.0585681036,"","","","","","",0.0014318964,0.06,"","",1PLuxJouUMUP7SjEYxJbXJQMkkG5qqparo,7775dd811388accbedf45b25a1e8d864f7da9d94725f5c1f2e9a5796a00e7211,first penny
2016-09-06 03:12:14 UTC,fiat_deposit,"","","","","",Coinbase,25.0,USD,"","","","",25.0,"",Wells Fargo - Checking ******2498,"","",Bought Ethereum Using Wells Fargo - Checking ******2498
2016-09-06 03:12:14 UTC,buy,"",Coinbase,24.63,USD,"",Coinbase,2.10003965,ETH,25.0,0.37,USD,"",24.63,0.37,"","",d7d27883-3090-547a-bb54-11e3a743c1ee,""
2017-01-18 14:56:55 UTC,fiat_deposit,"","","","","",Coinbase,10.35,USD,"","","","",10.35,"",Wells Fargo - Checking ******2498,"","",Bought Ethereum Using Wells Fargo - Checking ******2498
2017-01-18 14:56:55 UTC,buy,"",Coinbase,10.2,USD,"",Coinbase,1.00180485,ETH,10.35,0.15,USD,"",10.2,0.15,"","",233c9922-dd9a-59ce-a80d-1c9abfc06137,""
2017-01-18 21:32:51 UTC,sell,"",Coinbase,0.25,BTC,118.6003154208,Coinbase,217.9,USD,"",8.69,USD,90.6096845792,217.9,8.69,"","",4c8b2e5a-73e6-5228-bbed-e528dd2227b2,""
2017-01-18 21:45:34 UTC,fiat_deposit,"","","","","",Coinbase,205.38,USD,"","","","",205.38,"",MasterCard ********9599,"","",Bought Ethereum Using MasterCard ********9599
2017-01-18 21:45:34 UTC,buy,"",Coinbase,197.5,USD,"",Coinbase,19.43792413,ETH,205.38,7.88,USD,"",197.5,7.88,"","",c8d76871-47bc-53ae-b0ef-5963d56734dc,""
2017-01-20 02:29:22 UTC,fiat_deposit,"","","","","",Coinbase,10.69,USD,"","","","",10.69,"",Wells Fargo - Checking ******2498,"","",Bought Ethereum Using Wells Fargo - Checking ******2498
2017-01-20 02:29:22 UTC,buy,"",Coinbase,10.53,USD,"",Coinbase,1.0,ETH,10.69,0.16,USD,"",10.53,0.16,"","",0ba75d0c-956c-5a8a-8c57-b57169458df3,""
2017-01-21 14:59:13 UTC,crypto_withdrawal,"",Coinbase,0.00107965,BTC,0.4429291176,"","","","","","",0.5570708824,1.0,"","",1GHQ6SkPEcjS5Fy32ZqRgrgX2qF8j7WG86,967cf8696fd2f1daa92a528b49494e9e20230b6af9478dd842d26b43675089ba,Sent Bitcoin To Bitcoin address 1GHQ6SkPEcjS5Fy32ZqRgrgX2qF8j7WG86
2017-01-21 14:59:16 UTC,fiat_deposit,"","","","","",Coinbase,0.99,USD,"","","","",0.99,"","","",b698b7d8-f13a-545f-adfd-0bb13b6ceeeb,""
2017-01-21 20:07:12 UTC,crypto_withdrawal,"",Coinbase,0.00540564,BTC,2.2176773538,"","","","","","",2.7723226462,4.99,"","",1P3G28VsaqfpwvouZTwE5cVymwMovhgdhg,d404993efe0bf63bb0b3b376ff2c969b1da53e2adff7257a9c6608d931027df4,Sent Bitcoin To Bitcoin address 1P3G28VsaqfpwvouZTwE5cVymwMovhgdhg
2017-01-21 20:07:15 UTC,fiat_deposit,"","","","","",Coinbase,4.9,USD,"","","","",4.9,"","","",6d3bf030-4c68-507d-887f-a75e365c30e7,""
2017-01-21 20:58:56 UTC,fiat_withdrawal,"",Coinbase,5.89,USD,"","","","","","","","",5.89,"","",Wells Fargo - Checking ******2498,"",Withdrew funds To Wells Fargo - Checking ******2498
2017-01-22 01:20:03 UTC,fiat_deposit,"","","","","",Coinbase,11.16,USD,"","","","",11.16,"",Wells Fargo - Checking ******2498,"","",Bought Ethereum Using Wells Fargo - Checking ******2498
2017-01-22 01:20:03 UTC,buy,"",Coinbase,11.0,USD,"",Coinbase,1.0,ETH,11.16,0.16,USD,"",11.0,0.16,"","",8666b813-9c24-5156-b512-331d91ae155c,""
2017-01-22 23:25:11 UTC,sell,"",Coinbase,0.024,BTC,9.8460601319,Coinbase,22.08,USD,"",0.88,USD,11.3539398681,22.08,0.88,"","",701dc8a2-e8ce-5615-8353-6a8792d81a67,""
2017-01-22 23:32:39 UTC,buy,"",Coinbase,18.5,USD,"",Coinbase,1.70602041,ETH,19.24,0.74,USD,"",18.5,0.74,"","",29713b06-75d6-5667-80d5-0c8b02ecd752,""
2017-01-22 23:32:39 UTC,fiat_deposit,"","","","","",Coinbase,19.24,USD,"","","","",19.24,"",MasterCard ********9599,"","",Bought Ethereum Using MasterCard ********9599
2017-01-23 00:18:40 UTC,crypto_deposit,"","","","","",Coinbase,0.00199977,BTC,1.86,"","","",1.86,"","","",5ad9ed3c8251c35bd4ee433826e32ce7451cd25339765aab078da87f56a32a06,Received Bitcoin From Bitcoin address
2017-01-23 02:36:23 UTC,crypto_withdrawal,"",Coinbase,23.23420074,ETH,247.4024687039,"","","","","","",2.5975312961,250.0,"","",0xFa3840396976c28da3547541a7266De76a2451A4,8f8f64c49053d5635ddd841a13611b2abe1b0a35e0da4ea91002e0423bb9b50e,Sent Ethereum To Ethereum address 0xFa3840396976c28da3547541a7266De76a2451A4
2017-01-23 02:50:24 UTC,crypto_withdrawal,"",Coinbase,2.80112045,ETH,31.9120089599,"","","","","","",-1.8020089599,30.11,"","",0xFa3840396976c28da3547541a7266De76a2451A4,204ea494d14692b747712c60a22664dee82d914d9a283c05bfb7f1e30e57f352,Sent Ethereum To Ethereum address 0xFa3840396976c28da3547541a7266De76a2451A4
2017-01-23 04:48:53 UTC,crypto_withdrawal,"",Coinbase,0.21,ETH,2.4999527985,"","","","","","",-0.2499527985,2.25,"","",0xFa3840396976c28da3547541a7266De76a2451A4,87d983bf4b5c6a2abf9373bc5d14798191e5851c83702ef1292f2bd288413d7f,Sent Ethereum To Ethereum address 0xFa3840396976c28da3547541a7266De76a2451A4
2017-01-31 23:04:17 UTC,fiat_deposit,"","","","","",Coinbase,10.95,USD,"","","","",10.95,"",Wells Fargo - Checking ******2498,"","",Bought Ethereum Using Wells Fargo - Checking ******2498
2017-01-31 23:04:17 UTC,buy,"",Coinbase,10.79,USD,"",Coinbase,1.0,ETH,10.95,0.16,USD,"",10.79,0.16,"","",7055e470-a341-517c-930c-4589787c2db2,""
2017-02-13 21:30:36 UTC,crypto_withdrawal,"",Coinbase,2.0,ETH,22.3902173337,"","","","","","",0.2897826663,22.68,"","",0xFa3840396976c28da3547541a7266De76a2451A4,9b20a1630d0abf84bea36ede88d2aa687a5260e34ac50bf8f796e0f5f5b907a7,Sent Ethereum To Ethereum address 0xFa3840396976c28da3547541a7266De76a2451A4
2017-02-13 21:54:27 UTC,crypto_withdrawal,"",Coinbase,0.002,BTC,1.8600943581,"","","","","","",0.1499056419,2.01,"","",1AR5DnMgKCAKSjQYXmpUJZoRqZz7E4xZPL,18abd9d7cd5ddf0d3d4a2b89e713b497c55283fdf80ed716e051967242b74e83,Sent Bitcoin To Bitcoin address 1AR5DnMgKCAKSjQYXmpUJZoRqZz7E4xZPL
2017-03-29 15:12:38 UTC,fiat_deposit,"","","","","",Coinbase,10.15,USD,"","","","",10.15,"",Wells Fargo - Checking ******2498,"","",Bought Ethereum Using Wells Fargo - Checking ******2498
2017-03-29 15:12:38 UTC,buy,"",Coinbase,10.0,USD,"",Coinbase,0.1916827,ETH,10.15,0.15,USD,"",10.0,0.15,"","",a0253429-af01-54f4-bf1a-cd41023a0969,""
2017-04-03 18:05:16 UTC,crypto_deposit,"","","","","",Binance (Archived),0.0498895,ETH,2.3409454628,"","","",2.3409454628,"","","","",Short term ETH disposal from tax lot of 0.558579350000000 ETH acquired on 4/3/2017 10:05:16 PM via Buy.
2017-04-03 18:05:16 UTC,crypto_deposit,"","","","","",Binance (Archived),0.00805371,ETH,0.377901079,"","","",0.377901079,"","","","",Short term ETH disposal from tax lot of 0.558579350000000 ETH acquired on 4/3/2017 10:05:16 PM via Buy.
2017-04-03 18:05:16 UTC,crypto_deposit,"","","","","",Binance (Archived),0.0218614,ETH,1.0257939073,"","","",1.0257939073,"","","","",Short term ETH disposal from tax lot of 0.558579350000000 ETH acquired on 4/3/2017 10:05:16 PM via Buy.
2017-04-03 18:05:16 UTC,crypto_deposit,"","","","","",Binance (Archived),0.11624648,ETH,5.454588038,"","","",5.454588038,"","","","",Short term ETH disposal from tax lot of 0.558579350000000 ETH acquired on 4/3/2017 10:05:16 PM via Buy.
2017-04-03 22:05:16 UTC,fiat_deposit,"","","","","",Coinbase,26.21,USD,"","","","",26.21,"",MasterCard ********9599,"","",Bought Ethereum Using MasterCard ********9599
2017-04-03 22:05:16 UTC,buy,"",Coinbase,25.2,USD,"",Coinbase,0.55857935,ETH,26.21,1.01,USD,"",25.2,1.01,"","",3b2ce1f4-460a-5dbe-b53d-3342f53ab9b0,""
2017-04-04 00:58:46 UTC,crypto_withdrawal,"",Coinbase,0.559,ETH,26.2297379951,"","","","","","",-2.0997379951,24.13,"","",0xFa3840396976c28da3547541a7266De76a2451A4,028e4e2fca43257bab26396951f00c40876dd530203f86d1adf0609ed79594e6,Sent Ethereum To Ethereum address 0xFa3840396976c28da3547541a7266De76a2451A4
2017-04-04 21:18:31 UTC,crypto_deposit,"","","","","",Coinbase,28.8,ETH,1268.35,"","","",1268.35,"","","",1053250d9668cf50a1c505d522395448a8513d321fdaf95e782972d1ab7bd504,Received Ethereum From Ethereum address
2017-04-04 22:06:09 UTC,sell,"",Coinbase,28.8,ETH,1268.35,Coinbase,1255.42,USD,"",18.71,USD,-31.64,1255.42,18.71,"","",cf273693-58e9-54d7-8111-643d5cb52480,""
2017-05-01 18:35:25 UTC,crypto_deposit,"","","","","",Coinbase,0.00074402,BTC,1.08,"","","",1.08,"","","",30af0a671e2f622b3e942a96b1275635047b5105939386e634bbc736a7b1e145,Received Bitcoin From Bitcoin address
2017-05-01 18:44:25 UTC,crypto_withdrawal,"",Coinbase,0.19047817,ETH,8.9377325454,"","","","","","",6.1022674546,15.04,"","",0xFa3840396976c28da3547541a7266De76a2451A4,14150ab088af7503fabf8e000564b55a4ca7c738470d4f7c11d36e2957d09984,Sent Ethereum To Ethereum address 0xFa3840396976c28da3547541a7266De76a2451A4
2017-12-14 08:04:55 UTC,crypto_deposit,"","","","","",Coinbase,0.00084791,BCH,1.66,"","","",1.66,"",Bitcoin Cash address,"","",Received Bitcoin Cash From Bitcoin Cash address
2018-01-10 22:07:54 UTC,crypto_deposit,"","","","","",Binance (Archived),0.08192559,ETH,107.8029661513,"","","",107.8029661513,"","","","",Short term ETH disposal from tax lot of 0.113993510000000 ETH acquired on 1/11/2018 3:07:54 AM via Buy.
2018-01-10 22:07:54 UTC,crypto_deposit,"","","","","",Binance (Archived),0.03206792,ETH,41.6991990928,"","","",41.6991990928,"","","","",Short term ETH disposal from tax lot of 0.113993510000000 ETH acquired on 1/11/2018 3:07:54 AM via Buy.
2018-01-10 23:05:54 UTC,crypto_deposit,"","","","","",Binance (Archived),15.959,MIOTA,56.74445876,"","","",56.74445876,"","","","",Short term MIOTA disposal from tax lot of 40.959000000000000 MIOTA acquired on 1/11/2018 4:05:54 AM via Trade.
2018-01-10 23:05:54 UTC,crypto_deposit,"","","","","",Binance (Archived),25.0,MIOTA,88.891,"","","",88.891,"","","","",Short term MIOTA disposal from tax lot of 40.959000000000000 MIOTA acquired on 1/11/2018 4:05:54 AM via Trade.
2018-01-10 23:05:54 UTC,crypto_withdrawal,"",Binance (Archived),0.11624648,ETH,149.6078804727,"","","","","","",0.3921195272,150.0,"","","","",Bought 0.11399351 ETH for $150.00 USD
2018-01-11 03:07:54 UTC,buy,"",Coinbase,144.24,USD,"",Coinbase,0.11399351,ETH,150.0,5.76,USD,"",144.24,5.76,"","",07a0c35c-addd-5623-b969-08a1021bf259,""
2018-01-11 03:07:54 UTC,fiat_deposit,"","","","","",Coinbase,150.0,USD,"","","","",150.0,"",Visa credit ********8501,"","",Bought Ethereum Using Visa credit ********8501
2018-01-11 03:48:15 UTC,crypto_withdrawal,"",Coinbase,0.11524524,ETH,150.0587344364,"","","","","","",-8.0787344364,141.98,"","",0xFa3840396976c28da3547541a7266De76a2451A4,a4289e8d662cbb93072e15fdee421bf11529eea6c0d54a0820e76a629ee35754,Sent Ethereum To Ethereum address 0xFa3840396976c28da3547541a7266De76a2451A4
2018-01-11 10:46:18 UTC,crypto_deposit,"","","","","",Binance (Archived),0.01024355,BTC,150.0,"","","",150.0,"","","","",Short term BTC disposal from tax lot of 0.010243550000000 BTC acquired on 1/11/2018 3:46:18 PM via Buy.
2018-01-11 15:46:18 UTC,fiat_deposit,"","","","","",Coinbase,150.0,USD,"","","","",150.0,"",Visa credit ********8501,"","",Bought Bitcoin Using Visa credit ********8501
2018-01-11 15:46:18 UTC,buy,"",Coinbase,144.24,USD,"",Coinbase,0.01024355,BTC,150.0,5.76,USD,"",144.24,5.76,"","",bcee4d18-c93d-5aff-9f37-52670c37d7ea,""
2018-01-11 17:50:04 UTC,crypto_withdrawal,"",Binance (Archived),0.01024355,BTC,150.1667106518,"","","","","","",-16.7958945228,133.370816129,"","","","",Short term BTC disposal from tax lot of 0.010243550000000 BTC acquired on 1/11/2018 3:46:18 PM via Buy.
2018-01-11 17:50:04 UTC,crypto_deposit,"","","","","",Binance (Archived),42.957,MIOTA,162.2185191,"","","",162.2185191,"","","","",Short term MIOTA disposal from tax lot of 42.957000000000000 MIOTA acquired on 1/11/2018 10:50:04 PM via Trade.
2018-01-11 17:50:04 UTC,crypto_withdrawal,"",Binance (Archived),0.00010412,BTC,1.558488984,"","","","","","",-0.2028486664,1.3556403176,"","","","",Long term BTC disposal from tax lot of 0.025611210000000 BTC acquired on 8/29/2016 2:32:39 PM via Buy.
2018-01-11 17:50:04 UTC,crypto_deposit,"","","","","",Binance (Archived),0.00061733,BTC,9.240318906,"","","",9.240318906,"","","","",Short term BTC disposal from tax lot of 0 BTC acquired on 1/11/2018 10:50:04 PM via Reconciliation Event.
2018-01-11 17:50:04 UTC,crypto_withdrawal,"",Binance (Archived),0.00061733,BTC,9.0397860117,"","","","","","",-1.0021617583,8.0376242534,"","","","",Short term BTC disposal from tax lot of 0 BTC acquired on 1/11/2018 10:50:04 PM via Reconciliation Event.
2018-01-11 20:48:54 UTC,transfer,"",Coinbase,0.00084791,BCH,"",Coinbase Pro,0.00084791,BCH,"","","","",2.15,"",Coinbase,Coinbase Pro,coinbase_to_gdax,""
2018-01-11 21:26:16 UTC,transfer,"",Coinbase,0.01109146,BTC,"",Coinbase Pro,0.01109146,BTC,"","","","",148.59,"",Coinbase,Coinbase Pro,coinbase_to_gdax,""
2018-01-11 21:30:01 UTC,transfer,"",Coinbase Pro,0.01109146,BTC,"",Coinbase,0.01109146,BTC,"","","","",148.59,"",Coinbase Pro,Coinbase,gdax_to_coinbase,""
2018-01-12 11:22:16 UTC,crypto_deposit,"","","","","",Binance (Archived),0.00009066,BTC,1.2716643008,"","","",1.2716643008,"","","","",Short term BTC disposal from tax lot of 0.010693860000000 BTC acquired on 1/12/2018 4:22:16 PM via Buy.
2018-01-12 11:22:16 UTC,transfer,"",Coinbase,0.0106032,BTC,"",Binance (Archived),0.0106032,BTC,"",0.00048826,BTC,"",148.59,6.8423262223,"",18RGpbHyakz4oHehDpLTYGRhbrmRqeW9jA,528db4fb4de59d3979ea68890c1f26e53da7e7b0d33cf4c5624c914f412ea17b,Sent Bitcoin To Bitcoin address 18RGpbHyakz4oHehDpLTYGRhbrmRqeW9jA
2018-01-12 13:09:11 UTC,crypto_withdrawal,"",Binance (Archived),0.0106032,BTC,150.8751406908,"","","","","","",-8.6336368188,142.241503872,"","","","",Short term BTC disposal from tax lot of 0.010693860000000 BTC acquired on 1/12/2018 4:22:16 PM via Buy.
2018-01-12 13:09:11 UTC,crypto_deposit,"","","","","",Binance (Archived),28.876,MIOTA,97.58615324,"","","",97.58615324,"","","","",Short term MIOTA disposal from tax lot of 39.960000000000000 MIOTA acquired on 1/12/2018 6:09:11 PM via Trade.
2018-01-12 13:09:11 UTC,crypto_deposit,"","","","","",Binance (Archived),11.084,MIOTA,37.45826716,"","","",37.45826716,"","","","",Short term MIOTA disposal from tax lot of 39.960000000000000 MIOTA acquired on 1/12/2018 6:09:11 PM via Trade.
2018-01-12 16:22:16 UTC,fiat_deposit,"","","","","",Coinbase,150.0,USD,"","","","",150.0,"",Visa credit ********8501,"","",Bought Bitcoin Using Visa credit ********8501
2018-01-12 16:22:16 UTC,buy,"",Coinbase,144.24,USD,"",Coinbase,0.01069386,BTC,150.0,5.76,USD,"",144.24,5.76,"","",e555ff6a-6feb-5ace-b99a-571732451819,""
2018-01-12 16:23:47 UTC,transfer,"",Coinbase,0.01069386,BTC,"",Coinbase Pro,0.01069386,BTC,"","","","",144.94,"",Coinbase,Coinbase Pro,coinbase_to_gdax,""
2018-01-12 16:53:28 UTC,transfer,"",Coinbase Pro,0.01069386,BTC,"",Coinbase,0.01069386,BTC,"","","","",145.28,"",Coinbase Pro,Coinbase,gdax_to_coinbase,""
2018-01-12 18:07:22 UTC,crypto_deposit,"","","","","",Binance (Archived),0.00005239,BTC,0.7278433701,"","","",0.7278433701,"","","","",Short term BTC disposal from tax lot of 0.011522470000000 BTC acquired on 1/12/2018 11:07:22 PM via Trade.
2018-01-12 18:07:22 UTC,crypto_deposit,"","","","","",Binance (Archived),0.00205998,BTC,28.618873554,"","","",28.618873554,"","","","",Short term BTC disposal from tax lot of 0.011522470000000 BTC acquired on 1/12/2018 11:07:22 PM via Trade.
2018-01-12 18:07:22 UTC,transfer,"",Coinbase,0.0094101,BTC,"",Binance (Archived),0.0094101,BTC,"",0.00128376,BTC,"",145.28,19.8196249562,"",18RGpbHyakz4oHehDpLTYGRhbrmRqeW9jA,55b6c875c68518c14864665a462c4c11809c1593aa7e46977409ffdbc9cee28f,Sent Bitcoin To Bitcoin address 18RGpbHyakz4oHehDpLTYGRhbrmRqeW9jA
2018-01-12 18:07:22 UTC,crypto_deposit,"","","","","",Binance (Archived),79.0,XRP,153.29792,"","","",153.29792,"","","","",Short term XRP disposal from tax lot of 0 XRP acquired on 1/12/2018 11:07:22 PM via Reconciliation Event.
2018-01-12 18:07:22 UTC,crypto_withdrawal,"",Binance (Archived),79.0,XRP,153.29792,"","","","","","",6.78135842,160.07927842,"","","","",Short term XRP disposal from tax lot of 0 XRP acquired on 1/12/2018 11:07:22 PM via Reconciliation Event.
2018-01-12 18:32:31 UTC,crypto_withdrawal,"",Binance (Archived),0.0094101,BTC,131.4713838572,"","","","","","",-2.2705226552,129.200861202,"","","","",Short term BTC disposal from tax lot of 0.011522470000000 BTC acquired on 1/12/2018 11:07:22 PM via Trade.
2018-01-12 18:32:31 UTC,crypto_deposit,"","","","","",Binance (Archived),34.965,MIOTA,118.16386785,"","","",118.16386785,"","","","",Short term MIOTA disposal from tax lot of 34.965000000000000 MIOTA acquired on 1/12/2018 11:32:31 PM via Trade.
2018-01-12 18:32:31 UTC,crypto_deposit,"","","","","",Binance (Archived),7.992,MIOTA,27.00888408,"","","",27.00888408,"","","","",Short term MIOTA disposal from tax lot of 7.992000000000000 MIOTA acquired on 1/12/2018 11:32:31 PM via Trade.
2018-01-12 18:32:31 UTC,crypto_withdrawal,"",Binance (Archived),0.0000907,BTC,1.2600762295,"","","","","","",-0.0153126163,1.2447636132,"","","","",Short term BTC disposal from tax lot of 0.010693860000000 BTC acquired on 1/12/2018 4:22:16 PM via Buy.
2018-01-12 18:32:31 UTC,crypto_withdrawal,"",Binance (Archived),0.00205998,BTC,46.6309736109,"","","","","","",-18.3474070113,28.2835665996,"","","","",Short term BTC disposal from tax lot of 0.011522470000000 BTC acquired on 1/12/2018 11:07:22 PM via Trade.
2018-01-21 19:15:45 UTC,crypto_deposit,"","","","","",Binance (Archived),0.00815895,BTC,99.1797170826,"","","",99.1797170826,"","","","",Short term BTC disposal from tax lot of 0.008226430000000 BTC acquired on 1/22/2018 12:15:45 AM via Buy.
2018-01-21 19:15:45 UTC,crypto_deposit,"","","","","",Binance (Archived),0.00006748,BTC,0.8202829174,"","","",0.8202829174,"","","","",Short term BTC disposal from tax lot of 0.008226430000000 BTC acquired on 1/22/2018 12:15:45 AM via Buy.
2018-01-21 19:37:53 UTC,crypto_deposit,"","","","","",Binance (Archived),33.966,MIOTA,102.1442535,"","","",102.1442535,"","","","",Short term MIOTA disposal from tax lot of 33.966000000000000 MIOTA acquired on 1/22/2018 12:37:53 AM via Trade.
2018-01-21 19:37:53 UTC,crypto_withdrawal,"",Binance (Archived),0.00815895,BTC,99.1797170826,"","","","","","",-4.4805794016,94.699137681,"","","","",Short term BTC disposal from tax lot of 0.008226430000000 BTC acquired on 1/22/2018 12:15:45 AM via Buy.
2018-01-21 19:37:53 UTC,crypto_withdrawal,"",Binance (Archived),0.0000524,BTC,0.6369713229,"","","","","","",-0.0288921187,0.6080792042,"","","","",Short term BTC disposal from tax lot of 0.011522470000000 BTC acquired on 1/12/2018 11:07:22 PM via Trade.
2018-01-22 00:15:45 UTC,fiat_deposit,"","","","","",Coinbase,100.0,USD,"","","","",100.0,"",Visa credit ********8501,"","",Bought Bitcoin Using Visa credit ********8501
2018-01-22 00:15:45 UTC,buy,"",Coinbase,96.16,USD,"",Coinbase,0.00822643,BTC,100.0,3.84,USD,"",96.16,3.84,"","",5798c63d-cf42-5beb-8454-000b942ce86c,""
2018-01-22 00:17:30 UTC,transfer,"",Coinbase,0.00822643,BTC,"",Coinbase Pro,0.00822643,BTC,"","","","",95.76,"",Coinbase,Coinbase Pro,coinbase_to_gdax,""
2018-01-22 00:19:36 UTC,transfer,"",Coinbase Pro,0.00822643,BTC,"",Coinbase,0.00822643,BTC,"","","","",95.76,"",Coinbase Pro,Coinbase,gdax_to_coinbase,""
2018-01-22 00:19:38 UTC,crypto_withdrawal,"",Coinbase,0.00822643,BTC,100.0,"","","","","","",-4.24,95.76,"","",18RGpbHyakz4oHehDpLTYGRhbrmRqeW9jA,6f856a0b4d3300133e40a1f9f1dff03299b54d8c08f44aff0ceb2755dd680491,Sent Bitcoin To Bitcoin address 18RGpbHyakz4oHehDpLTYGRhbrmRqeW9jA
2018-02-01 18:55:47 UTC,crypto_deposit,"","","","","",Binance (Archived),0.01043954,BTC,98.7965968562,"","","",98.7965968562,"","","","",Short term BTC disposal from tax lot of 0.010566700000000 BTC acquired on 2/1/2018 11:55:47 PM via Buy.
2018-02-01 18:55:47 UTC,crypto_deposit,"","","","","",Binance (Archived),0.00012716,BTC,1.2034031438,"","","",1.2034031438,"","","","",Short term BTC disposal from tax lot of 0.010566700000000 BTC acquired on 2/1/2018 11:55:47 PM via Buy.
2018-02-01 20:13:04 UTC,crypto_withdrawal,"",Binance (Archived),0.0000675,BTC,0.6387992467,"","","","","","",-0.0335117443,0.6052875024,"","","","",Short term BTC disposal from tax lot of 0.008226430000000 BTC acquired on 1/22/2018 12:15:45 AM via Buy.
2018-02-01 20:13:04 UTC,crypto_deposit,"","","","","",Binance (Archived),50.949,MIOTA,117.67843377,"","","",117.67843377,"","","","",Short term MIOTA disposal from tax lot of 50.949000000000000 MIOTA acquired on 2/2/2018 1:13:04 AM via Trade.
2018-02-01 20:13:04 UTC,crypto_withdrawal,"",Binance (Archived),0.01043954,BTC,98.7965968562,"","","","","","",-5.155175801,93.6414210552,"","","","",Short term BTC disposal from tax lot of 0.010566700000000 BTC acquired on 2/1/2018 11:55:47 PM via Buy.
2018-02-01 23:55:47 UTC,fiat_deposit,"","","","","",Coinbase,100.0,USD,"","","","",100.0,"",Visa credit ********8501,"","",Bought Bitcoin Using Visa credit ********8501
2018-02-01 23:55:47 UTC,buy,"",Coinbase,96.16,USD,"",Coinbase,0.0105667,BTC,100.0,3.84,USD,"",96.16,3.84,"","",7d29df0b-971b-5ccb-a6d2-d8c5644521e4,""
2018-02-01 23:56:47 UTC,transfer,"",Coinbase,0.0105,BTC,"",Coinbase Pro,0.0105,BTC,"","","","",95.31,"",Coinbase,Coinbase Pro,coinbase_to_gdax,""
2018-02-02 00:00:47 UTC,transfer,"",Coinbase Pro,0.0105,BTC,"",Coinbase,0.0105,BTC,"","","","",94.61,"",Coinbase Pro,Coinbase,gdax_to_coinbase,""
2018-02-02 00:00:48 UTC,crypto_withdrawal,"",Coinbase,0.0105,BTC,99.3687717073,"","","","","","",-4.7587717073,94.61,"","",18RGpbHyakz4oHehDpLTYGRhbrmRqeW9jA,25689497ce69e2741573c7f351642678549e233f67f0e18a0854fc6efecbf3ac,Sent Bitcoin To Bitcoin address 18RGpbHyakz4oHehDpLTYGRhbrmRqeW9jA
2018-02-07 10:05:21 UTC,crypto_deposit,"","","","","",Binance (Archived),0.00005122,BTC,0.4352712108,"","","",0.4352712108,"","","","",Short term BTC disposal from tax lot of 0.029418440000000 BTC acquired on 2/7/2018 3:05:21 PM via Buy.
2018-02-07 10:05:21 UTC,crypto_deposit,"","","","","",Binance (Archived),0.02936722,BTC,249.5647287892,"","","",249.5647287892,"","","","",Short term BTC disposal from tax lot of 0.029418440000000 BTC acquired on 2/7/2018 3:05:21 PM via Buy.
2018-02-07 15:05:21 UTC,fiat_deposit,"","","","","",Coinbase,250.0,USD,"","","","",250.0,"",Wells Fargo - Primary ******2498,"","",Bought Bitcoin Using Wells Fargo - Primary ******2498
2018-02-07 15:05:21 UTC,buy,"",Coinbase,246.33,USD,"",Coinbase,0.02941844,BTC,250.0,3.67,USD,"",246.33,3.67,"","",341d18fc-9948-557e-a868-b03c174e5ff0,""
2018-02-11 21:14:01 UTC,crypto_deposit,"","","","","",Binance (Archived),0.0144012,BTC,125.0,"","","",125.0,"","","","",Short term BTC disposal from tax lot of 0.014401200000000 BTC acquired on 2/12/2018 2:14:01 AM via Buy.
2018-02-12 02:14:01 UTC,buy,"",Coinbase,120.2,USD,"",Coinbase,0.0144012,BTC,125.0,4.8,USD,"",120.2,4.8,"","",e56aa58d-d71c-5ce4-8621-9dd04dcac2f4,""
2018-02-12 02:14:01 UTC,fiat_deposit,"","","","","",Coinbase,125.0,USD,"","","","",125.0,"",Visa debit ********9413,"","",Bought Bitcoin Using Visa debit ********9413
2018-02-12 02:19:52 UTC,transfer,"",Coinbase,0.0144,BTC,"",Coinbase Pro,0.0144,BTC,"","","","",119.88,"",Coinbase,Coinbase Pro,coinbase_to_gdax,""
2018-02-12 02:23:28 UTC,transfer,"",Coinbase Pro,0.0144,BTC,"",Coinbase,0.0144,BTC,"","","","",119.88,"",Coinbase Pro,Coinbase,gdax_to_coinbase,""
2018-02-12 02:23:30 UTC,crypto_withdrawal,"",Coinbase,0.0144,BTC,124.9895842013,"","","","","","",-5.1095842013,119.88,"","",18kfzrxf2rpXmXZGnoxovw9tpLo2uDVVUJ,81af5deb64a7f3bfdfacd8a99729a38e30faf8d55899c91e806fb352876e7bf2,Sent Bitcoin To Bitcoin address 18kfzrxf2rpXmXZGnoxovw9tpLo2uDVVUJ
2018-02-13 13:22:04 UTC,crypto_withdrawal,"",Binance (Archived),0.00012716,BTC,1.1037274672,"","","","","","",-0.0081664996,1.0955609676,"","","","",Short term BTC disposal from tax lot of 0.010566700000000 BTC acquired on 2/1/2018 11:55:47 PM via Buy.
2018-02-13 13:22:04 UTC,crypto_withdrawal,"",Binance (Archived),0.02936722,BTC,252.1594100938,"","","","","","",0.8571042104,253.0165143042,"","","","",Short term BTC disposal from tax lot of 0.029418440000000 BTC acquired on 2/7/2018 3:05:21 PM via Buy.
2018-02-13 13:22:04 UTC,crypto_deposit,"","","","","",Binance (Archived),140.9577,MIOTA,262.638024948,"","","",262.638024948,"","","","",Short term MIOTA disposal from tax lot of 140.957700000000000 MIOTA acquired on 2/13/2018 6:22:04 PM via Trade.
2018-02-13 15:40:36 UTC,transfer,"",Coinbase,0.02948634,BTC,"",Coinbase Pro,0.02948634,BTC,"","","","",250.78,"",Coinbase,Coinbase Pro,coinbase_to_gdax,""
2018-02-13 15:43:08 UTC,transfer,"",Coinbase Pro,0.02948634,BTC,"",Coinbase,0.02948634,BTC,"","","","",250.78,"",Coinbase Pro,Coinbase,gdax_to_coinbase,""
2018-02-13 15:43:10 UTC,crypto_withdrawal,"",Coinbase,0.02948634,BTC,250.5770190398,"","","","","","",0.2029809602,250.78,"","",18RGpbHyakz4oHehDpLTYGRhbrmRqeW9jA,ac5830902c83a072bc00aff176477f0b3d176a4ba783f3b8b5af7681a286d6b6,Sent Bitcoin To Bitcoin address 18RGpbHyakz4oHehDpLTYGRhbrmRqeW9jA
2018-02-14 16:10:48 UTC,crypto_deposit,"","","","","",Binance (Archived),0.02602436,ETH,21.9988339221,"","","",21.9988339221,"","","","",Short term ETH disposal from tax lot of 0.026024360000000 ETH acquired on 2/14/2018 9:10:48 PM via Buy.
2018-02-14 16:11:30 UTC,crypto_deposit,"","","","","",Binance (Archived),0.02602812,ETH,22.002012314,"","","",22.002012314,"","","","",Short term ETH disposal from tax lot of 0.026028120000000 ETH acquired on 2/14/2018 9:11:30 PM via Buy.
2018-02-14 21:10:48 UTC,fiat_deposit,"","","","","",Coinbase,25.0,USD,"","","","",25.0,"",Wells Fargo - Primary ******2498,"","",Bought Ethereum Using Wells Fargo - Primary ******2498
2018-02-14 21:10:48 UTC,buy,"",Coinbase,23.51,USD,"",Coinbase,0.02602436,ETH,25.0,1.49,USD,"",23.51,1.49,"","",1aaccf56-96f8-5c2c-9267-e127670f4986,""
2018-02-14 21:11:30 UTC,buy,"",Coinbase,23.51,USD,"",Coinbase,0.02602812,ETH,25.0,1.49,USD,"",23.51,1.49,"","",d8fa004f-aa5a-5309-9180-5517b7828379,""
2018-02-14 21:11:30 UTC,fiat_deposit,"","","","","",Coinbase,25.0,USD,"","","","",25.0,"",Visa debit ********9413,"","",Bought Ethereum Using Visa debit ********9413
2018-02-14 21:13:52 UTC,crypto_withdrawal,"",Coinbase,0.02602812,ETH,25.0,"","","","","","",-1.61,23.39,"","",0x598993d3Cb79fa85745E04b9F1a0ea38295673c5,eaf008ee96518dd751022025998c34ca95f8e8357263ec2137bce78741a8e404,Sent Ethereum To Ethereum address 0x598993d3Cb79fa85745E04b9F1a0ea38295673c5
2018-02-22 20:09:19 UTC,crypto_withdrawal,"",Coinbase,0.02602436,ETH,25.0,"","","","","","",-3.92,21.08,"","",0x938BFe980b3405c40Df876869f48Db512a075aA2,c1f7a9c7f87a45ff45e8b8095272b76aaa7fe07dfeb94413d4be3fab02bd76ac,Sent Ethereum To Ethereum address 0x938BFe980b3405c40Df876869f48Db512a075aA2
2018-02-24 17:35:00 UTC,crypto_deposit,"","","","","",Binance (Archived),0.01023279,BTC,103.1774632323,"","","",103.1774632323,"","","","",Short term BTC disposal from tax lot of 0.024794150000000 BTC acquired on 2/24/2018 10:35:00 PM via Buy.
2018-02-24 17:35:00 UTC,crypto_deposit,"","","","","",Binance (Archived),0.01456136,BTC,146.8225367677,"","","",146.8225367677,"","","","",Short term BTC disposal from tax lot of 0.024794150000000 BTC acquired on 2/24/2018 10:35:00 PM via Buy.
2018-02-24 22:35:00 UTC,buy,"",Coinbase,240.41,USD,"",Coinbase,0.02479415,BTC,250.0,9.59,USD,"",240.41,9.59,"","",c9865198-068d-5557-b892-a26400c069cd,""
2018-02-24 22:35:00 UTC,fiat_deposit,"","","","","",Coinbase,250.0,USD,"","","","",250.0,"",Visa debit ********9413,"","",Bought Bitcoin Using Visa debit ********9413
2018-02-24 23:07:39 UTC,crypto_withdrawal,"",Binance (Archived),0.01023279,BTC,103.1774632323,"","","","","","",-4.3390469502,98.8384162821,"","","","",Short term BTC disposal from tax lot of 0.024794150000000 BTC acquired on 2/24/2018 10:35:00 PM via Buy.
2018-02-24 23:07:39 UTC,crypto_withdrawal,"",Binance (Archived),0.0000512,BTC,0.5162508092,"","","","","","",-0.0215173414,0.4947334678,"","","","",Short term BTC disposal from tax lot of 0.029418440000000 BTC acquired on 2/7/2018 3:05:21 PM via Buy.
2018-02-24 23:07:39 UTC,crypto_deposit,"","","","","",Binance (Archived),120.879,MIOTA,214.49857671,"","","",214.49857671,"","","","",Short term MIOTA disposal from tax lot of 120.879000000000000 MIOTA acquired on 2/25/2018 4:07:39 AM via Trade.
2018-02-24 23:07:39 UTC,crypto_withdrawal,"",Binance (Archived),0.0144012,BTC,145.2076397053,"","","","","","",-6.1065929173,139.101046788,"","","","",Short term BTC disposal from tax lot of 0.014401200000000 BTC acquired on 2/12/2018 2:14:01 AM via Buy.
2018-02-25 03:43:05 UTC,crypto_withdrawal,"",Coinbase,0.02479415,BTC,250.0,"","","","","","",-12.5999999999,237.4,"","",18RGpbHyakz4oHehDpLTYGRhbrmRqeW9jA,4682b9af252dc483b605b689302378f42733c32950273121145d3ac0ba7cbf4a,Sent Bitcoin To Bitcoin address 18RGpbHyakz4oHehDpLTYGRhbrmRqeW9jA
2018-03-06 14:32:28 UTC,crypto_deposit,"","","","","",Binance (Archived),0.01462948,BTC,161.5602392634,"","","",161.5602392634,"","","","",Short term BTC disposal from tax lot of 0.022637810000000 BTC acquired on 3/6/2018 7:32:28 PM via Buy.
2018-03-06 14:32:28 UTC,crypto_deposit,"","","","","",Binance (Archived),0.00800833,BTC,88.4397607366,"","","",88.4397607366,"","","","",Short term BTC disposal from tax lot of 0.022637810000000 BTC acquired on 3/6/2018 7:32:28 PM via Buy.
2018-03-06 15:02:53 UTC,crypto_withdrawal,"",Binance (Archived),0.01456136,BTC,160.8079580136,"","","","","","",-5.4382468136,155.3697112,"","","","",Short term BTC disposal from tax lot of 0.024794150000000 BTC acquired on 2/24/2018 10:35:00 PM via Buy.
2018-03-06 15:02:53 UTC,crypto_deposit,"","","","","",Binance (Archived),136.4153,MIOTA,252.338293634,"","","",252.338293634,"","","","",Short term MIOTA disposal from tax lot of 142.857000000000000 MIOTA acquired on 3/6/2018 8:02:53 PM via Trade.
2018-03-06 15:02:53 UTC,crypto_withdrawal,"",Binance (Archived),0.00800833,BTC,88.4397607366,"","","","","","",-2.9908796366,85.4488811,"","","","",Short term BTC disposal from tax lot of 0.022637810000000 BTC acquired on 3/6/2018 7:32:28 PM via Buy.
2018-03-06 15:02:53 UTC,crypto_deposit,"","","","","",Binance (Archived),6.4417,MIOTA,11.915727826,"","","",11.915727826,"","","","",Short term MIOTA disposal from tax lot of 142.857000000000000 MIOTA acquired on 3/6/2018 8:02:53 PM via Trade.
2018-03-06 19:32:28 UTC,buy,"",Coinbase,240.41,USD,"",Coinbase,0.02263781,BTC,250.0,9.59,USD,"",240.41,9.59,"","",fd37ef9e-a49d-5732-ab3a-56ead70ffae4,""
2018-03-06 19:32:28 UTC,fiat_deposit,"","","","","",Coinbase,250.0,USD,"","","","",250.0,"",Visa debit ********9413,"","",Bought Bitcoin Using Visa debit ********9413
2018-03-06 19:48:02 UTC,crypto_withdrawal,"",Coinbase,0.02263781,BTC,250.0,"","","","","","",-8.0,242.0,"","",18RGpbHyakz4oHehDpLTYGRhbrmRqeW9jA,082fe714a9b37a6b6d238cfea9db7b5d4341c434464a44ee75713d83804335ee,Sent Bitcoin To Bitcoin address 18RGpbHyakz4oHehDpLTYGRhbrmRqeW9jA
2018-03-07 13:45:35 UTC,crypto_deposit,"","","","","",Binance (Archived),0.00412447,BTC,42.3781894328,"","","",42.3781894328,"","","","",Short term BTC disposal from tax lot of 0.048662650000000 BTC acquired on 3/7/2018 6:45:35 PM via Buy.
2018-03-07 13:45:35 UTC,crypto_deposit,"","","","","",Binance (Archived),0.01019672,BTC,104.769468987,"","","",104.769468987,"","","","",Short term BTC disposal from tax lot of 0.048662650000000 BTC acquired on 3/7/2018 6:45:35 PM via Buy.
2018-03-07 13:45:35 UTC,crypto_deposit,"","","","","",Binance (Archived),0.023901,BTC,245.5784878135,"","","",245.5784878135,"","","","",Short term BTC disposal from tax lot of 0.048662650000000 BTC acquired on 3/7/2018 6:45:35 PM via Buy.
2018-03-07 13:45:35 UTC,crypto_deposit,"","","","","",Binance (Archived),0.01044046,BTC,107.2738537667,"","","",107.2738537667,"","","","",Short term BTC disposal from tax lot of 0.048662650000000 BTC acquired on 3/7/2018 6:45:35 PM via Buy.
2018-03-07 14:19:59 UTC,crypto_withdrawal,"",Binance (Archived),0.01019672,BTC,104.769468987,"","","","","","",-6.167186587,98.6022824,"","","","",Short term BTC disposal from tax lot of 0.048662650000000 BTC acquired on 3/7/2018 6:45:35 PM via Buy.
2018-03-07 14:19:59 UTC,crypto_deposit,"","","","","",Binance (Archived),160.839,MIOTA,273.45685941,"","","",273.45685941,"","","","",Short term MIOTA disposal from tax lot of 160.839000000000000 MIOTA acquired on 3/7/2018 7:19:59 PM via Trade.
2018-03-07 14:19:59 UTC,crypto_withdrawal,"",Binance (Archived),0.01462948,BTC,150.3152828709,"","","","","","",-8.8482112709,141.4670716,"","","","",Short term BTC disposal from tax lot of 0.022637810000000 BTC acquired on 3/6/2018 7:32:28 PM via Buy.
2018-03-07 14:20:01 UTC,crypto_deposit,"","","","","",Binance (Archived),154.845,MIOTA,263.26592055,"","","",263.26592055,"","","","",Short term MIOTA disposal from tax lot of 154.845000000000000 MIOTA acquired on 3/7/2018 7:20:01 PM via Trade.
2018-03-07 14:20:01 UTC,crypto_withdrawal,"",Binance (Archived),0.023901,BTC,245.6281042002,"","","","","","",-14.7205432002,230.907561,"","","","",Short term BTC disposal from tax lot of 0.048662650000000 BTC acquired on 3/7/2018 6:45:35 PM via Buy.
2018-03-07 18:45:35 UTC,buy,"",Coinbase,480.82,USD,"",Coinbase,0.04866265,BTC,500.0,19.18,USD,"",480.82,19.18,"","",9b5c9a5d-5eef-5676-8688-fa46fd744524,""
2018-03-07 18:45:35 UTC,fiat_deposit,"","","","","",Coinbase,500.0,USD,"","","","",500.0,"",Visa debit ********9413,"","",Bought Bitcoin Using Visa debit ********9413
2018-03-07 18:47:13 UTC,crypto_withdrawal,"",Coinbase,0.04866265,BTC,500.0,"","","","","","",-22.63,477.37,"","",18RGpbHyakz4oHehDpLTYGRhbrmRqeW9jA,bd9ef47c5ea3113dde4ad5538fa67a49d3debf75886e22a594edcf52292ecf13,Sent Bitcoin To Bitcoin address 18RGpbHyakz4oHehDpLTYGRhbrmRqeW9jA
2018-03-07 21:23:34 UTC,crypto_withdrawal,"",Binance (Archived),0.0218614,ETH,18.4798130638,"","","","","","",-2.4202100098,16.059603054,"","","","",Short term ETH disposal from tax lot of 0.558579350000000 ETH acquired on 4/3/2017 10:05:16 PM via Buy.
2018-03-07 21:23:34 UTC,crypto_deposit,"","","","","",Binance (Archived),10.989,MIOTA,18.68338791,"","","",18.68338791,"","","","",Short term MIOTA disposal from tax lot of 10.989000000000000 MIOTA acquired on 3/8/2018 2:23:34 AM via Trade.
2018-03-07 22:25:16 UTC,crypto_deposit,"","","","","",Binance (Archived),24.975,MIOTA,42.46224525,"","","",42.46224525,"","","","",Short term MIOTA disposal from tax lot of 24.975000000000000 MIOTA acquired on 3/8/2018 3:25:16 AM via Trade.
2018-03-07 22:25:16 UTC,crypto_withdrawal,"",Binance (Archived),0.08192559,ETH,4.3381313937,"","","","","","",56.2097951517,60.5479265454,"","","","",Short term ETH disposal from tax lot of 0.113993510000000 ETH acquired on 1/11/2018 3:07:54 AM via Buy.
2018-03-07 22:25:16 UTC,crypto_deposit,"","","","","",Binance (Archived),44.955,MIOTA,76.43204145,"","","",76.43204145,"","","","",Short term MIOTA disposal from tax lot of 44.955000000000000 MIOTA acquired on 3/8/2018 3:25:16 AM via Trade.
2018-03-07 22:25:16 UTC,crypto_withdrawal,"",Binance (Archived),0.00805371,ETH,0.4264607943,"","","","","","",5.5257141183,5.9521749126,"","","","",Short term ETH disposal from tax lot of 0.558579350000000 ETH acquired on 4/3/2017 10:05:16 PM via Buy.
2018-03-07 22:25:16 UTC,crypto_withdrawal,"",Binance (Archived),0.0498895,ETH,26.5541717271,"","","","","","",10.3171621429,36.87133387,"","","","",Short term ETH disposal from tax lot of 0.558579350000000 ETH acquired on 4/3/2017 10:05:16 PM via Buy.
2018-03-08 21:40:19 UTC,crypto_deposit,"","","","","",Binance (Archived),0.00271592,BTC,25.7402921363,"","","",25.7402921363,"","","","",Short term BTC disposal from tax lot of 0.010551240000000 BTC acquired on 3/9/2018 2:40:19 AM via Buy.
2018-03-08 21:40:19 UTC,crypto_deposit,"","","","","",Binance (Archived),0.00005537,BTC,0.5247724438,"","","",0.5247724438,"","","","",Short term BTC disposal from tax lot of 0.010551240000000 BTC acquired on 3/9/2018 2:40:19 AM via Buy.
2018-03-08 21:40:19 UTC,crypto_deposit,"","","","","",Binance (Archived),0.00457135,BTC,43.3252394979,"","","",43.3252394979,"","","","",Short term BTC disposal from tax lot of 0.010551240000000 BTC acquired on 3/9/2018 2:40:19 AM via Buy.
2018-03-08 21:40:19 UTC,crypto_deposit,"","","","","",Binance (Archived),0.0032086,BTC,30.409695922,"","","",30.409695922,"","","","",Short term BTC disposal from tax lot of 0.010551240000000 BTC acquired on 3/9/2018 2:40:19 AM via Buy.
2018-03-08 22:00:55 UTC,crypto_withdrawal,"",Binance (Archived),0.01044046,BTC,98.95007601,"","","","","","",-5.8204419778,93.1296340322,"","","","",Short term BTC disposal from tax lot of 0.048662650000000 BTC acquired on 3/7/2018 6:45:35 PM via Buy.
2018-03-08 22:00:55 UTC,crypto_deposit,"","","","","",Binance (Archived),72.927,MIOTA,107.20341927,"","","",107.20341927,"","","","",Short term MIOTA disposal from tax lot of 72.927000000000000 MIOTA acquired on 3/9/2018 3:00:55 AM via Trade.
2018-03-09 02:40:19 UTC,buy,"",Coinbase,96.16,USD,"",Coinbase,0.01055124,BTC,100.0,3.84,USD,"",96.16,3.84,"","",03a2857a-916c-5215-a0a1-6b1ca879fde6,""
2018-03-09 02:40:19 UTC,fiat_deposit,"","","","","",Coinbase,100.0,USD,"","","","",100.0,"",Visa debit ********9413,"","",Bought Bitcoin Using Visa debit ********9413
2018-03-09 02:41:36 UTC,crypto_withdrawal,"",Coinbase,0.01055124,BTC,100.0,"","","","","","",-5.06,94.94,"","",18RGpbHyakz4oHehDpLTYGRhbrmRqeW9jA,49d458ab031842c78a8bcf56c0e71556e770e78cb76b32b8d3355e50b5cd24bf,Sent Bitcoin To Bitcoin address 18RGpbHyakz4oHehDpLTYGRhbrmRqeW9jA
2018-03-15 14:07:04 UTC,crypto_deposit,"","","","","",Binance (Archived),0.00878084,BTC,75.0,"","","",75.0,"","","","",Short term BTC disposal from tax lot of 0.008780840000000 BTC acquired on 3/15/2018 6:07:04 PM via Buy.
2018-03-15 14:31:11 UTC,crypto_withdrawal,"",Binance (Archived),0.00457135,BTC,39.045381763,"","","","","","",-2.0762800375,36.9691017255,"","","","",Short term BTC disposal from tax lot of 0.010551240000000 BTC acquired on 3/9/2018 2:40:19 AM via Buy.
2018-03-15 14:31:11 UTC,crypto_deposit,"","","","","",Binance (Archived),31.968,MIOTA,34.41099456,"","","",34.41099456,"","","","",Short term MIOTA disposal from tax lot of 31.968000000000000 MIOTA acquired on 3/15/2018 6:31:11 PM via Trade.
2018-03-15 14:31:11 UTC,crypto_deposit,"","","","","",Binance (Archived),34.965,MIOTA,37.6370253,"","","",37.6370253,"","","","",Short term MIOTA disposal from tax lot of 34.965000000000000 MIOTA acquired on 3/15/2018 6:31:11 PM via Trade.
2018-03-15 14:31:11 UTC,crypto_withdrawal,"",Binance (Archived),0.00412447,BTC,35.228434865,"","","","","","",-1.8733097939,33.3551250711,"","","","",Short term BTC disposal from tax lot of 0.048662650000000 BTC acquired on 3/7/2018 6:45:35 PM via Buy.
2018-03-15 14:31:11 UTC,crypto_withdrawal,"",Binance (Archived),0.0000554,BTC,0.4731893532,"","","","","","",-0.0254049651,0.4477843881,"","","","",Short term BTC disposal from tax lot of 0.010551240000000 BTC acquired on 3/9/2018 2:40:19 AM via Buy.
2018-03-15 18:07:04 UTC,buy,"",Coinbase,72.01,USD,"",Coinbase,0.00878084,BTC,75.0,2.99,USD,"",72.01,2.99,"","",1c658138-b0b3-5d59-a225-a794717cdfb8,""
2018-03-15 18:07:04 UTC,fiat_deposit,"","","","","",Coinbase,75.0,USD,"","","","",75.0,"",Visa debit ********9413,"","",Bought Bitcoin Using Visa debit ********9413
2018-03-15 18:09:09 UTC,crypto_withdrawal,"",Coinbase,0.00878084,BTC,75.0,"","","","","","",-3.23,71.77,"","",18RGpbHyakz4oHehDpLTYGRhbrmRqeW9jA,d7d36a6cc82892da1b208899a858c2bf515f42689f03878d69186ddc4f1c0c72,Sent Bitcoin To Bitcoin address 18RGpbHyakz4oHehDpLTYGRhbrmRqeW9jA
2018-03-19 17:39:52 UTC,crypto_deposit,"","","","","",Binance (Archived),0.00124207,BTC,11.1991363335,"","","",11.1991363335,"","","","",Short term BTC disposal from tax lot of 0.002606330000000 BTC acquired on 3/19/2018 9:39:52 PM via Buy.
2018-03-19 17:39:52 UTC,crypto_deposit,"","","","","",Binance (Archived),0.00136426,BTC,12.3008636665,"","","",12.3008636665,"","","","",Short term BTC disposal from tax lot of 0.002606330000000 BTC acquired on 3/19/2018 9:39:52 PM via Buy.
2018-03-19 21:39:52 UTC,fiat_deposit,"","","","","",Coinbase,23.5,USD,"","","","",23.5,"",Visa debit ********9413,"","",Bought Bitcoin Using Visa debit ********9413
2018-03-19 21:39:52 UTC,buy,"",Coinbase,22.01,USD,"",Coinbase,0.00260633,BTC,23.5,1.49,USD,"",22.01,1.49,"","",e1828e2a-0774-5dda-bb01-33badfe5095c,""
2018-03-20 08:18:44 UTC,crypto_withdrawal,"",Binance (Archived),0.00271592,BTC,24.4881193095,"","","","","","",-1.4161616359,23.0719576736,"","","","",Short term BTC disposal from tax lot of 0.010551240000000 BTC acquired on 3/9/2018 2:40:19 AM via Buy.
2018-03-20 08:18:44 UTC,crypto_deposit,"","","","","",Binance (Archived),16.983,MIOTA,22.28865903,"","","",22.28865903,"","","","",Short term MIOTA disposal from tax lot of 16.983000000000000 MIOTA acquired on 3/20/2018 12:18:44 PM via Trade.
2018-03-20 11:30:22 UTC,crypto_withdrawal,"",Coinbase,0.00260633,BTC,23.5227951054,"","","","","","",-1.2727951054,22.25,"","",18RGpbHyakz4oHehDpLTYGRhbrmRqeW9jA,f43306be3eb276afbc9d15a6f02d0816312517b007bd367f791a2a983e201cf5,Sent Bitcoin To Bitcoin address 18RGpbHyakz4oHehDpLTYGRhbrmRqeW9jA
2018-03-20 21:44:37 UTC,crypto_deposit,"","","","","",Binance (Archived),0.01336964,BTC,125.0,"","","",125.0,"","","","",Short term BTC disposal from tax lot of 0.013369640000000 BTC acquired on 3/21/2018 1:44:37 AM via Buy.
2018-03-20 23:08:37 UTC,crypto_withdrawal,"",Binance (Archived),0.0032086,BTC,29.9989378921,"","","","","","",-1.2948022921,28.7041356,"","","","",Short term BTC disposal from tax lot of 0.010551240000000 BTC acquired on 3/9/2018 2:40:19 AM via Buy.
2018-03-20 23:08:37 UTC,crypto_withdrawal,"",Binance (Archived),0.00878084,BTC,82.0968253446,"","","","","","",-3.5434307046,78.55339464,"","","","",Short term BTC disposal from tax lot of 0.008780840000000 BTC acquired on 3/15/2018 6:07:04 PM via Buy.
2018-03-20 23:08:37 UTC,crypto_withdrawal,"",Binance (Archived),0.00136426,BTC,12.7552050766,"","","","","","",-0.5505351166,12.20466996,"","","","",Short term BTC disposal from tax lot of 0.002606330000000 BTC acquired on 3/19/2018 9:39:52 PM via Buy.
2018-03-20 23:08:37 UTC,crypto_deposit,"","","","","",Binance (Archived),81.918,MIOTA,107.51000238,"","","",107.51000238,"","","","",Short term MIOTA disposal from tax lot of 81.918000000000000 MIOTA acquired on 3/21/2018 3:08:37 AM via Trade.
2018-03-21 01:44:37 UTC,fiat_deposit,"","","","","",Coinbase,125.0,USD,"","","","",125.0,"",Visa debit ********9413,"","",Bought Bitcoin Using Visa debit ********9413
2018-03-21 01:44:37 UTC,buy,"",Coinbase,120.2,USD,"",Coinbase,0.01336964,BTC,125.0,4.8,USD,"",120.2,4.8,"","",37a80603-f268-5cc7-9616-25e288742ade,""
2018-03-21 01:48:00 UTC,crypto_withdrawal,"",Coinbase,0.01336964,BTC,125.0,"","","","","","",-5.41,119.59,"","",18RGpbHyakz4oHehDpLTYGRhbrmRqeW9jA,886c6e9f1cecaca454d8e1f773afacac619bff80a697121a227459ad1e64a8d0,Sent Bitcoin To Bitcoin address 18RGpbHyakz4oHehDpLTYGRhbrmRqeW9jA
2018-03-31 23:47:53 UTC,crypto_deposit,"","","","","",Binance (Archived),0.00523094,BTC,37.9685772486,"","","",37.9685772486,"","","","",Short term BTC disposal from tax lot of 0.017221280000000 BTC acquired on 4/1/2018 3:47:53 AM via Buy.
2018-03-31 23:47:53 UTC,crypto_deposit,"","","","","",Binance (Archived),0.0013605,BTC,9.8751370398,"","","",9.8751370398,"","","","",Short term BTC disposal from tax lot of 0.017221280000000 BTC acquired on 4/1/2018 3:47:53 AM via Buy.
2018-03-31 23:47:53 UTC,crypto_deposit,"","","","","",Binance (Archived),0.00143238,BTC,10.3968752613,"","","",10.3968752613,"","","","",Short term BTC disposal from tax lot of 0.017221280000000 BTC acquired on 4/1/2018 3:47:53 AM via Buy.
2018-03-31 23:47:53 UTC,crypto_deposit,"","","","","",Binance (Archived),0.00255819,BTC,18.5685239425,"","","",18.5685239425,"","","","",Short term BTC disposal from tax lot of 0.017221280000000 BTC acquired on 4/1/2018 3:47:53 AM via Buy.
2018-03-31 23:47:53 UTC,crypto_deposit,"","","","","",Binance (Archived),0.00663927,BTC,48.1908865079,"","","",48.1908865079,"","","","",Short term BTC disposal from tax lot of 0.017221280000000 BTC acquired on 4/1/2018 3:47:53 AM via Buy.
2018-03-31 23:59:53 UTC,crypto_withdrawal,"",Binance (Archived),0.01336964,BTC,97.0430188697,"","","","","","",-4.5252437661,92.5177751036,"","","","",Short term BTC disposal from tax lot of 0.013369640000000 BTC acquired on 3/21/2018 1:44:37 AM via Buy.
2018-03-31 23:59:53 UTC,crypto_deposit,"","","","","",Binance (Archived),109.89,MIOTA,125.2899846,"","","",125.2899846,"","","","",Short term MIOTA disposal from tax lot of 109.890000000000000 MIOTA acquired on 4/1/2018 3:59:53 AM via Trade.
2018-03-31 23:59:53 UTC,crypto_withdrawal,"",Binance (Archived),0.00124207,BTC,9.0155174296,"","","","","","",-0.4204054503,8.5951119793,"","","","",Short term BTC disposal from tax lot of 0.002606330000000 BTC acquired on 3/19/2018 9:39:52 PM via Buy.
2018-03-31 23:59:53 UTC,crypto_withdrawal,"",Binance (Archived),0.00255819,BTC,18.5685239425,"","","","","","",-0.8658747244,17.7026492181,"","","","",Short term BTC disposal from tax lot of 0.017221280000000 BTC acquired on 4/1/2018 3:47:53 AM via Buy.
2018-04-01 03:47:53 UTC,buy,"",Coinbase,120.2,USD,"",Coinbase,0.01722128,BTC,125.0,4.8,USD,"",120.2,4.8,"","",592d6ba0-ed53-574c-91f1-89e9ad89652b,""
2018-04-01 03:47:53 UTC,fiat_deposit,"","","","","",Coinbase,125.0,USD,"","","","",125.0,"",Visa debit ********9413,"","",Bought Bitcoin Using Visa debit ********9413
2018-04-01 03:49:27 UTC,crypto_withdrawal,"",Coinbase,0.01722128,BTC,125.0,"","","","","","",-5.31,119.69,"","",18RGpbHyakz4oHehDpLTYGRhbrmRqeW9jA,a40c6228f6ff5b88a45519cbd6dc0842699269827b8154531b5d0edddeda7745,Sent Bitcoin To Bitcoin address 18RGpbHyakz4oHehDpLTYGRhbrmRqeW9jA
2018-04-14 11:52:33 UTC,crypto_deposit,"","","","","",Binance (Archived),0.00423562,BTC,35.3258004897,"","","",35.3258004897,"","","","",Short term BTC disposal from tax lot of 0.011990160000000 BTC acquired on 4/14/2018 3:52:33 PM via Buy.
2018-04-14 11:52:33 UTC,crypto_deposit,"","","","","",Binance (Archived),0.00775454,BTC,64.6741995103,"","","",64.6741995103,"","","","",Short term BTC disposal from tax lot of 0.011990160000000 BTC acquired on 4/14/2018 3:52:33 PM via Buy.
2018-04-14 15:52:33 UTC,buy,"",Coinbase,96.16,USD,"",Coinbase,0.01199016,BTC,100.0,3.84,USD,"",96.16,3.84,"","",8e754967-b215-5128-b15d-0ed9a6317b19,""
2018-04-14 15:52:33 UTC,fiat_deposit,"","","","","",Coinbase,100.0,USD,"","","","",100.0,"",Visa debit ********9413,"","",Bought Bitcoin Using Visa debit ********9413
2018-04-17 11:24:52 UTC,crypto_withdrawal,"",Binance (Archived),0.00663927,BTC,55.3726555776,"","","","","","",-1.6408442895,53.7318112881,"","","","",Short term BTC disposal from tax lot of 0.017221280000000 BTC acquired on 4/1/2018 3:47:53 AM via Buy.
2018-04-17 11:24:52 UTC,crypto_withdrawal,"",Binance (Archived),0.00523094,BTC,43.6269407581,"","","","","","",-1.2927864099,42.3341543482,"","","","",Short term BTC disposal from tax lot of 0.017221280000000 BTC acquired on 4/1/2018 3:47:53 AM via Buy.
2018-04-17 11:24:52 UTC,crypto_deposit,"","","","","",Binance (Archived),25.974,MIOTA,41.4986598,"","","",41.4986598,"","","","",Short term MIOTA disposal from tax lot of 25.974000000000000 MIOTA acquired on 4/17/2018 3:24:52 PM via Trade.
2018-04-17 11:24:52 UTC,crypto_deposit,"","","","","",Binance (Archived),32.967,MIOTA,52.6713759,"","","",52.6713759,"","","","",Short term MIOTA disposal from tax lot of 32.967000000000000 MIOTA acquired on 4/17/2018 3:24:52 PM via Trade.
2018-04-17 13:41:13 UTC,crypto_withdrawal,"",Coinbase,0.01199016,BTC,100.0,"","","","","","",-2.82,97.18,"","",18RGpbHyakz4oHehDpLTYGRhbrmRqeW9jA,0f9a9e09c5d6e65b92d44a8834d49c88969226a310b0a44578fa8ee0e90cb5d8,Sent Bitcoin To Bitcoin address 18RGpbHyakz4oHehDpLTYGRhbrmRqeW9jA
2018-05-13 22:00:15 UTC,crypto_deposit,"","","","","",Binance (Archived),0.0008593,BTC,7.8078489553,"","","",7.8078489553,"","","","",Short term BTC disposal from tax lot of 0.027513980000000 BTC acquired on 5/14/2018 2:00:15 AM via Buy.
2018-05-13 22:00:15 UTC,crypto_deposit,"","","","","",Binance (Archived),0.00482304,BTC,43.8235398877,"","","",43.8235398877,"","","","",Short term BTC disposal from tax lot of 0.027513980000000 BTC acquired on 5/14/2018 2:00:15 AM via Buy.
2018-05-13 22:00:15 UTC,crypto_deposit,"","","","","",Binance (Archived),0.01178944,BTC,107.1222702059,"","","",107.1222702059,"","","","",Short term BTC disposal from tax lot of 0.027513980000000 BTC acquired on 5/14/2018 2:00:15 AM via Buy.
2018-05-13 22:00:15 UTC,crypto_deposit,"","","","","",Binance (Archived),0.0100422,BTC,91.246340951,"","","",91.246340951,"","","","",Short term BTC disposal from tax lot of 0.027513980000000 BTC acquired on 5/14/2018 2:00:15 AM via Buy.
2018-05-13 22:21:13 UTC,crypto_deposit,"","","","","",Binance (Archived),37.962,MIOTA,71.6646636,"","","",71.6646636,"","","","",Short term MIOTA disposal from tax lot of 37.962000000000000 MIOTA acquired on 5/14/2018 2:21:13 AM via Trade.
2018-05-13 22:21:13 UTC,crypto_withdrawal,"",Binance (Archived),0.0013605,BTC,12.361897479,"","","","","","",-0.617095524,11.744801955,"","","","",Short term BTC disposal from tax lot of 0.017221280000000 BTC acquired on 4/1/2018 3:47:53 AM via Buy.
2018-05-13 22:21:13 UTC,crypto_withdrawal,"",Binance (Archived),0.00143238,BTC,13.0150200007,"","","","","","",-0.6496988509,12.3653211498,"","","","",Short term BTC disposal from tax lot of 0.017221280000000 BTC acquired on 4/1/2018 3:47:53 AM via Buy.
2018-05-13 22:21:13 UTC,crypto_withdrawal,"",Binance (Archived),0.00423562,BTC,38.4860714444,"","","","","","",-1.9211923142,36.5648791302,"","","","",Short term BTC disposal from tax lot of 0.011990160000000 BTC acquired on 4/14/2018 3:52:33 PM via Buy.
2018-05-13 22:21:13 UTC,crypto_withdrawal,"",Binance (Archived),0.00775454,BTC,70.4599988806,"","","","","","",-3.5173038772,66.9426950034,"","","","",Short term BTC disposal from tax lot of 0.011990160000000 BTC acquired on 4/14/2018 3:52:33 PM via Buy.
2018-05-13 22:21:13 UTC,crypto_withdrawal,"",Binance (Archived),0.0008593,BTC,7.8078489553,"","","","","","",-0.3897612523,7.418087703,"","","","",Short term BTC disposal from tax lot of 0.027513980000000 BTC acquired on 5/14/2018 2:00:15 AM via Buy.
2018-05-13 22:21:13 UTC,crypto_withdrawal,"",Binance (Archived),0.01178944,BTC,107.1222702059,"","","","","","",-5.3474536235,101.7748165824,"","","","",Short term BTC disposal from tax lot of 0.027513980000000 BTC acquired on 5/14/2018 2:00:15 AM via Buy.
2018-05-13 22:21:13 UTC,crypto_deposit,"","","","","",Binance (Archived),5.994,MIOTA,11.3154732,"","","",11.3154732,"","","","",Short term MIOTA disposal from tax lot of 5.994000000000000 MIOTA acquired on 5/14/2018 2:21:13 AM via Trade.
2018-05-13 22:21:13 UTC,crypto_deposit,"","","","","",Binance (Archived),24.975,MIOTA,47.147805,"","","",47.147805,"","","","",Short term MIOTA disposal from tax lot of 24.975000000000000 MIOTA acquired on 5/14/2018 2:21:13 AM via Trade.
2018-05-13 22:21:13 UTC,crypto_deposit,"","","","","",Binance (Archived),51.948,MIOTA,98.0674344,"","","",98.0674344,"","","","",Short term MIOTA disposal from tax lot of 51.948000000000000 MIOTA acquired on 5/14/2018 2:21:13 AM via Trade.
2018-05-14 02:00:15 UTC,buy,"",Coinbase,240.41,USD,"",Coinbase,0.02751398,BTC,250.0,9.59,USD,"",240.41,9.59,"","",e7d4d364-09da-5e57-9971-5fed693da605,""
2018-05-14 02:00:15 UTC,fiat_deposit,"","","","","",Coinbase,250.0,USD,"","","","",250.0,"",Visa debit ********9413,"","",Bought Bitcoin Using Visa debit ********9413
2018-05-14 02:06:07 UTC,crypto_withdrawal,"",Coinbase,0.02751398,BTC,250.0,"","","","","","",-10.79,239.21,"","",18RGpbHyakz4oHehDpLTYGRhbrmRqeW9jA,d5fdbeba716ac77d6525a0697d61dba534f886ef4aed15fbc22522d8b37e109b,Sent Bitcoin To Bitcoin address 18RGpbHyakz4oHehDpLTYGRhbrmRqeW9jA
2018-05-16 10:18:22 UTC,crypto_deposit,"","","","","",Binance (Archived),0.00267792,BTC,22.9238801718,"","","",22.9238801718,"","","","",Short term BTC disposal from tax lot of 0.029204480000000 BTC acquired on 5/16/2018 2:18:22 PM via Buy.
2018-05-16 10:18:22 UTC,crypto_deposit,"","","","","",Binance (Archived),0.00521916,BTC,44.677734375,"","","",44.677734375,"","","","",Short term BTC disposal from tax lot of 0.029204480000000 BTC acquired on 5/16/2018 2:18:22 PM via Buy.
2018-05-16 10:18:22 UTC,crypto_deposit,"","","","","",Binance (Archived),0.00072496,BTC,6.2058971774,"","","",6.2058971774,"","","","",Short term BTC disposal from tax lot of 0.029204480000000 BTC acquired on 5/16/2018 2:18:22 PM via Buy.
2018-05-16 10:18:22 UTC,crypto_deposit,"","","","","",Binance (Archived),0.0141108,BTC,120.7931111939,"","","",120.7931111939,"","","","",Short term BTC disposal from tax lot of 0.029204480000000 BTC acquired on 5/16/2018 2:18:22 PM via Buy.
2018-05-16 10:18:22 UTC,crypto_deposit,"","","","","",Binance (Archived),0.00647164,BTC,55.3993770819,"","","",55.3993770819,"","","","",Short term BTC disposal from tax lot of 0.029204480000000 BTC acquired on 5/16/2018 2:18:22 PM via Buy.
2018-05-16 11:15:43 UTC,crypto_deposit,"","","","","",Binance (Archived),44.955,MIOTA,86.24751615,"","","",86.24751615,"","","","",Short term MIOTA disposal from tax lot of 44.955000000000000 MIOTA acquired on 5/16/2018 3:15:43 PM via Trade.
2018-05-16 11:15:43 UTC,crypto_withdrawal,"",Binance (Archived),0.00482304,BTC,41.2868162693,"","","","","","",-1.6883556485,39.5984606208,"","","","",Short term BTC disposal from tax lot of 0.027513980000000 BTC acquired on 5/14/2018 2:00:15 AM via Buy.
2018-05-16 11:15:43 UTC,crypto_withdrawal,"",Binance (Archived),0.00521916,BTC,44.677734375,"","","","","","",-1.8270216018,42.8507127732,"","","","",Short term BTC disposal from tax lot of 0.029204480000000 BTC acquired on 5/16/2018 2:18:22 PM via Buy.
2018-05-16 11:15:43 UTC,crypto_withdrawal,"",Binance (Archived),0.0100422,BTC,85.9645506443,"","","","","","",-3.5153772503,82.449173394,"","","","",Short term BTC disposal from tax lot of 0.027513980000000 BTC acquired on 5/14/2018 2:00:15 AM via Buy.
2018-05-16 11:15:43 UTC,crypto_deposit,"","","","","",Binance (Archived),44.955,MIOTA,86.24751615,"","","",86.24751615,"","","","",Short term MIOTA disposal from tax lot of 44.955000000000000 MIOTA acquired on 5/16/2018 3:15:43 PM via Trade.
2018-05-16 11:15:53 UTC,crypto_deposit,"","","","","",Binance (Archived),11.988,MIOTA,22.99933764,"","","",22.99933764,"","","","",Short term MIOTA disposal from tax lot of 11.988000000000000 MIOTA acquired on 5/16/2018 3:15:53 PM via Trade.
2018-05-16 11:15:53 UTC,crypto_withdrawal,"",Binance (Archived),0.00267792,BTC,22.9238801718,"","","","","","",-0.9374339334,21.9864462384,"","","","",Short term BTC disposal from tax lot of 0.029204480000000 BTC acquired on 5/16/2018 2:18:22 PM via Buy.
2018-05-16 11:17:34 UTC,crypto_deposit,"","","","","",Binance (Archived),28.971,MIOTA,55.58173263,"","","",55.58173263,"","","","",Short term MIOTA disposal from tax lot of 28.971000000000000 MIOTA acquired on 5/16/2018 3:17:34 PM via Trade.
2018-05-16 11:17:34 UTC,crypto_withdrawal,"",Binance (Archived),0.00647164,BTC,55.4148823674,"","","","","","",-2.2814236394,53.133458728,"","","","",Short term BTC disposal from tax lot of 0.029204480000000 BTC acquired on 5/16/2018 2:18:22 PM via Buy.
2018-05-16 14:18:22 UTC,buy,"",Coinbase,240.41,USD,"",Coinbase,0.02920448,BTC,250.0,9.59,USD,"",240.41,9.59,"","",9ae76aa2-7dd1-5fd4-aaab-ccf1751606d1,""
2018-05-16 14:18:22 UTC,fiat_deposit,"","","","","",Coinbase,250.0,USD,"","","","",250.0,"",Visa debit ********9413,"","",Bought Bitcoin Using Visa debit ********9413
2018-05-16 14:19:16 UTC,crypto_withdrawal,"",Coinbase,0.02920448,BTC,250.0,"","","","","","",-10.8,239.2,"","",18RGpbHyakz4oHehDpLTYGRhbrmRqeW9jA,24a8ebff48224cde378fbd7c1325138a56f22d488f3f48c8c815a559999093d3,Sent Bitcoin To Bitcoin address 18RGpbHyakz4oHehDpLTYGRhbrmRqeW9jA
2018-05-20 19:15:57 UTC,crypto_deposit,"","","","","",Binance (Archived),0.00760994,BTC,67.7231803412,"","","",67.7231803412,"","","","",Short term BTC disposal from tax lot of 0.014046040000000 BTC acquired on 5/20/2018 11:15:57 PM via Buy.
2018-05-20 19:15:57 UTC,crypto_deposit,"","","","","",Binance (Archived),0.0064361,BTC,57.2768196588,"","","",57.2768196588,"","","","",Short term BTC disposal from tax lot of 0.014046040000000 BTC acquired on 5/20/2018 11:15:57 PM via Buy.
2018-05-20 21:40:25 UTC,crypto_deposit,"","","","","",Binance (Archived),1.3187,MIOTA,2.30442825,"","","",2.30442825,"","","","",Short term MIOTA disposal from tax lot of 65.934000000000000 MIOTA acquired on 5/21/2018 1:40:25 AM via Trade.
2018-05-20 21:40:25 UTC,crypto_withdrawal,"",Binance (Archived),0.0141108,BTC,125.5794448804,"","","","","","",-0.5794448803,125.0,"","","","",Bought 0.01404604 BTC for $125.00 USD
2018-05-20 21:40:25 UTC,crypto_deposit,"","","","","",Binance (Archived),64.6153,MIOTA,112.91523675,"","","",112.91523675,"","","","",Short term MIOTA disposal from tax lot of 65.934000000000000 MIOTA acquired on 5/21/2018 1:40:25 AM via Trade.
2018-05-20 23:15:57 UTC,buy,"",Coinbase,120.2,USD,"",Coinbase,0.01404604,BTC,125.0,4.8,USD,"",120.2,4.8,"","",4327efe4-6d16-5cf2-a56f-d1e21dbaf721,""
2018-05-20 23:15:57 UTC,fiat_deposit,"","","","","",Coinbase,125.0,USD,"","","","",125.0,"",Visa debit ********9413,"","",Bought Bitcoin Using Visa debit ********9413
2018-05-21 01:14:04 UTC,crypto_withdrawal,"",Coinbase,0.01404604,BTC,125.0,"","","","","","",-5.97,119.03,"","",18RGpbHyakz4oHehDpLTYGRhbrmRqeW9jA,48b0b9190399d8bce62e82f6eaefb3e88c3a7c42725b3f7c756fd000710e542d,Sent Bitcoin To Bitcoin address 18RGpbHyakz4oHehDpLTYGRhbrmRqeW9jA
2018-05-27 20:44:39 UTC,crypto_deposit,"","","","","",Binance (Archived),0.00021389,BTC,1.6451603872,"","","",1.6451603872,"","","","",Short term BTC disposal from tax lot of 0.032502910000000 BTC acquired on 5/28/2018 12:44:39 AM via Buy.
2018-05-27 20:44:39 UTC,crypto_deposit,"","","","","",Binance (Archived),0.0177687,BTC,136.6700704645,"","","",136.6700704645,"","","","",Short term BTC disposal from tax lot of 0.032502910000000 BTC acquired on 5/28/2018 12:44:39 AM via Buy.
2018-05-27 20:44:39 UTC,crypto_deposit,"","","","","",Binance (Archived),0.01129907,BTC,86.9081414556,"","","",86.9081414556,"","","","",Short term BTC disposal from tax lot of 0.032502910000000 BTC acquired on 5/28/2018 12:44:39 AM via Buy.
2018-05-27 20:44:39 UTC,crypto_deposit,"","","","","",Binance (Archived),0.00322125,BTC,24.7766276927,"","","",24.7766276927,"","","","",Short term BTC disposal from tax lot of 0.032502910000000 BTC acquired on 5/28/2018 12:44:39 AM via Buy.
2018-05-27 21:12:57 UTC,crypto_withdrawal,"",Binance (Archived),0.00760994,BTC,58.5327590668,"","","","","","",-2.7481699962,55.7845890706,"","","","",Short term BTC disposal from tax lot of 0.014046040000000 BTC acquired on 5/20/2018 11:15:57 PM via Buy.
2018-05-27 21:12:57 UTC,crypto_withdrawal,"",Binance (Archived),0.0064361,BTC,49.5040290239,"","","","","","",-2.3242623349,47.179766689,"","","","",Short term BTC disposal from tax lot of 0.014046040000000 BTC acquired on 5/20/2018 11:15:57 PM via Buy.
2018-05-27 21:12:57 UTC,crypto_withdrawal,"",Binance (Archived),0.0177687,BTC,136.6939307395,"","","","","","",-6.4406530765,130.253277663,"","","","",Short term BTC disposal from tax lot of 0.032502910000000 BTC acquired on 5/28/2018 12:44:39 AM via Buy.
2018-05-27 21:12:57 UTC,crypto_withdrawal,"",Binance (Archived),0.00072496,BTC,5.5761161078,"","","","","","",-0.2618040774,5.3143120304,"","","","",Short term BTC disposal from tax lot of 0.029204480000000 BTC acquired on 5/16/2018 2:18:22 PM via Buy.
2018-05-27 21:12:57 UTC,crypto_deposit,"","","","","",Binance (Archived),121.878,MIOTA,178.63170948,"","","",178.63170948,"","","","",Short term MIOTA disposal from tax lot of 121.878000000000000 MIOTA acquired on 5/28/2018 1:12:57 AM via Trade.
2018-05-27 21:12:57 UTC,crypto_deposit,"","","","","",Binance (Archived),41.958,MIOTA,61.49616228,"","","",61.49616228,"","","","",Short term MIOTA disposal from tax lot of 41.958000000000000 MIOTA acquired on 5/28/2018 1:12:57 AM via Trade.
2018-05-28 00:44:39 UTC,fiat_deposit,"","","","","",Coinbase,250.0,USD,"","","","",250.0,"",Visa debit ********9413,"","",Bought Bitcoin Using Visa debit ********9413
2018-05-28 00:44:39 UTC,buy,"",Coinbase,240.41,USD,"",Coinbase,0.03250291,BTC,250.0,9.59,USD,"",240.41,9.59,"","",6a44303a-2967-5cab-9330-0288240449b3,""
2018-05-28 00:46:45 UTC,crypto_withdrawal,"",Coinbase,0.03250291,BTC,250.0,"","","","","","",-10.88,239.12,"","",18RGpbHyakz4oHehDpLTYGRhbrmRqeW9jA,5f7955124fcce278a33fab7e6d0c887fb7dabc6dabd26d406a7d2f6ee310b26c,Sent Bitcoin To Bitcoin address 18RGpbHyakz4oHehDpLTYGRhbrmRqeW9jA
2018-05-29 22:57:55 UTC,crypto_deposit,"","","","","",Binance (Archived),0.00163499,BTC,12.8264466124,"","","",12.8264466124,"","","","",Short term BTC disposal from tax lot of 0.011472320000000 BTC acquired on 5/30/2018 2:57:55 AM via Buy.
2018-05-29 22:57:55 UTC,crypto_deposit,"","","","","",Binance (Archived),0.00296942,BTC,23.2950092048,"","","",23.2950092048,"","","","",Short term BTC disposal from tax lot of 0.011472320000000 BTC acquired on 5/30/2018 2:57:55 AM via Buy.
2018-05-29 22:57:55 UTC,crypto_deposit,"","","","","",Binance (Archived),0.00686791,BTC,53.8785441829,"","","",53.8785441829,"","","","",Short term BTC disposal from tax lot of 0.011472320000000 BTC acquired on 5/30/2018 2:57:55 AM via Buy.
2018-05-30 00:29:18 UTC,crypto_withdrawal,"",Binance (Archived),0.01129907,BTC,88.6408590417,"","","","","","",-8.6408590417,80.0,"","","","",Bought 0.01023737 BTC for $80.00 USD
2018-05-30 00:29:18 UTC,crypto_deposit,"","","","","",Binance (Archived),52.947,MIOTA,71.83160649,"","","",71.83160649,"","","","",Short term MIOTA disposal from tax lot of 52.947000000000000 MIOTA acquired on 5/30/2018 4:29:18 AM via Trade.
2018-05-30 02:57:55 UTC,buy,"",Coinbase,86.55,USD,"",Coinbase,0.01147232,BTC,90.0,3.45,USD,"",86.55,3.45,"","",6d772a7a-4b45-5da5-afc3-0ee60d4fb110,""
2018-05-30 02:57:55 UTC,fiat_deposit,"","","","","",Coinbase,90.0,USD,"","","","",90.0,"",Visa debit ********9413,"","",Bought Bitcoin Using Visa debit ********9413
2018-05-30 05:34:10 UTC,transfer,"",Coinbase,0.01023737,BTC,"",Binance (Archived),0.01023737,BTC,"",0.00123495,BTC,"",86.23,10.4020601483,"",18RGpbHyakz4oHehDpLTYGRhbrmRqeW9jA,1adc198a9e05cbaf4425487924e486b96d34beac8c749e1a888fda4b7f5a120a,Sent Bitcoin To Bitcoin address 18RGpbHyakz4oHehDpLTYGRhbrmRqeW9jA
2018-05-30 07:49:35 UTC,crypto_deposit,"","","","","",Binance (Archived),32.967,MIOTA,53.92511091,"","","",53.92511091,"","","","",Short term MIOTA disposal from tax lot of 32.967000000000000 MIOTA acquired on 5/30/2018 11:49:35 AM via Trade.
2018-05-30 07:49:35 UTC,crypto_withdrawal,"",Binance (Archived),0.00686791,BTC,63.5666892137,"","","","","","",-12.0217884399,51.5449007738,"","","","",Short term BTC disposal from tax lot of 0.011472320000000 BTC acquired on 5/30/2018 2:57:55 AM via Buy.
2018-05-30 07:49:35 UTC,crypto_withdrawal,"",Binance (Archived),0.00322125,BTC,25.2706078631,"","","","","","",-1.0945467881,24.176061075,"","","","",Short term BTC disposal from tax lot of 0.032502910000000 BTC acquired on 5/28/2018 12:44:39 AM via Buy.
2018-05-30 07:49:35 UTC,crypto_withdrawal,"",Binance (Archived),0.00021389,BTC,1.6779605171,"","","","","","",-0.0726775669,1.6052829502,"","","","",Short term BTC disposal from tax lot of 0.032502910000000 BTC acquired on 5/28/2018 12:44:39 AM via Buy.
2018-05-30 07:49:35 UTC,crypto_deposit,"","","","","",Binance (Archived),14.985,MIOTA,24.51141405,"","","",24.51141405,"","","","",Short term MIOTA disposal from tax lot of 14.985000000000000 MIOTA acquired on 5/30/2018 11:49:35 AM via Trade.
2018-05-30 09:34:10 UTC,fiat_deposit,"","","","","",Coinbase,80.0,USD,"","","","",80.0,"",Visa debit ********9413,"","",Bought Bitcoin Using Visa debit ********9413
2018-05-30 09:34:10 UTC,buy,"",Coinbase,76.93,USD,"",Coinbase,0.01023737,BTC,80.0,3.07,USD,"",76.93,3.07,"","",960ce823-e2c8-5729-bc16-f0c13286fca6,""
2018-05-30 09:35:32 UTC,crypto_withdrawal,"",Coinbase,0.01023737,BTC,80.0,"","","","","","",-3.48,76.52,"","",18RGpbHyakz4oHehDpLTYGRhbrmRqeW9jA,ea257fbf55fbadb1fae0efe59b9cc6c8a3bc38701a5ef01b2dc6f496a0d34376,Sent Bitcoin To Bitcoin address 18RGpbHyakz4oHehDpLTYGRhbrmRqeW9jA
2018-06-03 17:16:38 UTC,crypto_deposit,"","","","","",Binance (Archived),0.00174285,BTC,15.0,"","","",15.0,"","","","",Short term BTC disposal from tax lot of 0.001742850000000 BTC acquired on 6/3/2018 9:16:38 PM via Buy.
2018-06-03 18:13:51 UTC,crypto_withdrawal,"",Binance (Archived),0.00163499,BTC,14.0716929168,"","","","","","",-1.4921125566,12.5795803602,"","","","",Short term BTC disposal from tax lot of 0.011472320000000 BTC acquired on 5/30/2018 2:57:55 AM via Buy.
2018-06-03 18:13:51 UTC,crypto_deposit,"","","","","",Binance (Archived),6.993,MIOTA,13.27425246,"","","",13.27425246,"","","","",Short term MIOTA disposal from tax lot of 6.993000000000000 MIOTA acquired on 6/3/2018 10:13:51 PM via Trade.
2018-06-03 21:16:38 UTC,fiat_deposit,"","","","","",Coinbase,15.0,USD,"","","","",15.0,"",Visa debit ********9413,"","",Bought Bitcoin Using Visa debit ********9413
2018-06-03 21:16:38 UTC,buy,"",Coinbase,13.51,USD,"",Coinbase,0.00174285,BTC,15.0,1.49,USD,"",13.51,1.49,"","",6ef60d3a-a09c-5616-ba81-bf2cfc7eff7c,""
2018-06-03 21:17:23 UTC,crypto_withdrawal,"",Coinbase,0.00174285,BTC,15.0,"","","","","","",-1.56,13.44,"","",18RGpbHyakz4oHehDpLTYGRhbrmRqeW9jA,7658605f4eeebc89d87e9271c0da1537cb0025e4d38a44d0f2dcc4e1009d488a,Sent Bitcoin To Bitcoin address 18RGpbHyakz4oHehDpLTYGRhbrmRqeW9jA
2018-06-22 16:00:17 UTC,crypto_deposit,"","","","","",Binance (Archived),0.00479911,BTC,31.0760390387,"","","",31.0760390387,"","","","",Short term BTC disposal from tax lot of 0.038607800000000 BTC acquired on 6/22/2018 8:00:17 PM via Buy.
2018-06-22 16:00:17 UTC,crypto_deposit,"","","","","",Binance (Archived),0.01878834,BTC,121.661555437,"","","",121.661555437,"","","","",Short term BTC disposal from tax lot of 0.038607800000000 BTC acquired on 6/22/2018 8:00:17 PM via Buy.
2018-06-22 16:00:17 UTC,crypto_deposit,"","","","","",Binance (Archived),0.01502035,BTC,97.2624055243,"","","",97.2624055243,"","","","",Short term BTC disposal from tax lot of 0.038607800000000 BTC acquired on 6/22/2018 8:00:17 PM via Buy.
2018-06-22 16:19:13 UTC,crypto_withdrawal,"",Binance (Archived),0.00479911,BTC,31.0760390387,"","","","","","",-1.7367280448,29.3393109939,"","","","",Short term BTC disposal from tax lot of 0.038607800000000 BTC acquired on 6/22/2018 8:00:17 PM via Buy.
2018-06-22 16:19:13 UTC,crypto_deposit,"","","","","",Binance (Archived),124.875,MIOTA,141.69816,"","","",141.69816,"","","","",Short term MIOTA disposal from tax lot of 124.875000000000000 MIOTA acquired on 6/22/2018 8:19:13 PM via Trade.
2018-06-22 16:19:13 UTC,crypto_withdrawal,"",Binance (Archived),0.01023737,BTC,66.2908142914,"","","","","","",-3.7047551701,62.5860591213,"","","","",Short term BTC disposal from tax lot of 0.010237370000000 BTC acquired on 5/30/2018 9:34:10 AM via Buy.
2018-06-22 16:19:13 UTC,crypto_withdrawal,"",Binance (Archived),0.00174285,BTC,11.2856080896,"","","","","","",-0.6307120431,10.6548960465,"","","","",Short term BTC disposal from tax lot of 0.001742850000000 BTC acquired on 6/3/2018 9:16:38 PM via Buy.
2018-06-22 16:19:13 UTC,crypto_withdrawal,"",Binance (Archived),0.00296942,BTC,19.2281093458,"","","","","","",-1.07458987,18.1535194758,"","","","",Short term BTC disposal from tax lot of 0.011472320000000 BTC acquired on 5/30/2018 2:57:55 AM via Buy.
2018-06-22 20:00:17 UTC,fiat_deposit,"","","","","",Coinbase,250.0,USD,"","","","",250.0,"",Visa debit ********9413,"","",Bought Bitcoin Using Visa debit ********9413
2018-06-22 20:00:17 UTC,buy,"",Coinbase,240.41,USD,"",Coinbase,0.0386078,BTC,250.0,9.59,USD,"",240.41,9.59,"","",77af766d-327f-5616-832d-d3870eca2306,""
2018-06-22 20:01:20 UTC,crypto_withdrawal,"",Coinbase,0.0386078,BTC,250.0,"","","","","","",-10.77,239.23,"","",18RGpbHyakz4oHehDpLTYGRhbrmRqeW9jA,10ffd8e1fcf9e8d97262d72e0a2b18b0115bb086e7887b6524b3729f985d0bd9,Sent Bitcoin To Bitcoin address 18RGpbHyakz4oHehDpLTYGRhbrmRqeW9jA
2018-06-23 13:28:18 UTC,crypto_deposit,"","","","","",Binance (Archived),113.886,MIOTA,117.90731466,"","","",117.90731466,"","","","",Short term MIOTA disposal from tax lot of 113.886000000000000 MIOTA acquired on 6/23/2018 5:28:18 PM via Trade.
2018-06-23 13:28:18 UTC,crypto_withdrawal,"",Binance (Archived),0.01878834,BTC,121.661555437,"","","","","","",-6.9138356044,114.7477198326,"","","","",Short term BTC disposal from tax lot of 0.038607800000000 BTC acquired on 6/22/2018 8:00:17 PM via Buy.
2018-06-29 11:18:27 UTC,crypto_deposit,"","","","","",Binance (Archived),0.00540269,BTC,33.2429861458,"","","",33.2429861458,"","","","",Short term BTC disposal from tax lot of 0.020315150000000 BTC acquired on 6/29/2018 3:18:27 PM via Buy.
2018-06-29 11:18:27 UTC,crypto_deposit,"","","","","",Binance (Archived),0.01491246,BTC,91.7570138542,"","","",91.7570138542,"","","","",Short term BTC disposal from tax lot of 0.020315150000000 BTC acquired on 6/29/2018 3:18:27 PM via Buy.
2018-06-29 11:51:38 UTC,crypto_deposit,"","","","","",Binance (Archived),131.868,MIOTA,120.859263756,"","","",120.859263756,"","","","",Short term MIOTA disposal from tax lot of 131.868000000000000 MIOTA acquired on 6/29/2018 3:51:38 PM via Trade.
2018-06-29 11:51:38 UTC,crypto_withdrawal,"",Binance (Archived),0.00540269,BTC,33.3570012036,"","","","","","",-1.5675192167,31.7894819869,"","","","",Short term BTC disposal from tax lot of 0.020315150000000 BTC acquired on 6/29/2018 3:18:27 PM via Buy.
2018-06-29 11:51:38 UTC,crypto_withdrawal,"",Binance (Archived),0.01502035,BTC,92.4208657086,"","","","","","",-4.0409761051,88.3798896035,"","","","",Short term BTC disposal from tax lot of 0.038607800000000 BTC acquired on 6/22/2018 8:00:17 PM via Buy.
2018-06-29 15:18:27 UTC,buy,"",Coinbase,120.2,USD,"",Coinbase,0.02031515,BTC,125.0,4.8,USD,"",120.2,4.8,"","",a3c27faf-2c0b-5fd8-a7d8-35e97251c725,""
2018-06-29 15:18:27 UTC,fiat_deposit,"","","","","",Coinbase,125.0,USD,"","","","",125.0,"",Visa debit ********9413,"","",Bought Bitcoin Using Visa debit ********9413
2018-06-29 15:20:38 UTC,crypto_withdrawal,"",Coinbase,0.02031515,BTC,125.0,"","","","","","",-5.41,119.59,"","",18RGpbHyakz4oHehDpLTYGRhbrmRqeW9jA,8a3886f5e8ca61f420bbf975b4161350e2e756c1c42b18cbd93c46a20253414b,Sent Bitcoin To Bitcoin address 18RGpbHyakz4oHehDpLTYGRhbrmRqeW9jA
2018-06-29 21:07:58 UTC,crypto_deposit,"","","","","",Binance (Archived),0.015624,BTC,101.8690665621,"","","",101.8690665621,"","","","",Short term BTC disposal from tax lot of 0.030674670000000 BTC acquired on 6/30/2018 1:07:58 AM via Buy.
2018-06-29 21:07:58 UTC,crypto_deposit,"","","","","",Binance (Archived),0.01505067,BTC,98.1309334379,"","","",98.1309334379,"","","","",Short term BTC disposal from tax lot of 0.030674670000000 BTC acquired on 6/30/2018 1:07:58 AM via Buy.
2018-06-29 21:21:25 UTC,crypto_withdrawal,"",Binance (Archived),0.015624,BTC,101.8690665621,"","","","","","",-4.1098548021,97.75921176,"","","","",Short term BTC disposal from tax lot of 0.030674670000000 BTC acquired on 6/30/2018 1:07:58 AM via Buy.
2018-06-29 21:21:25 UTC,crypto_deposit,"","","","","",Binance (Archived),152.4827,MIOTA,139.7529867559,"","","",139.7529867559,"","","","",Short term MIOTA disposal from tax lot of 192.807000000000000 MIOTA acquired on 6/30/2018 1:21:25 AM via Trade.
2018-06-29 21:21:25 UTC,crypto_deposit,"","","","","",Binance (Archived),40.3243,MIOTA,36.9579064631,"","","",36.9579064631,"","","","",Short term MIOTA disposal from tax lot of 192.807000000000000 MIOTA acquired on 6/30/2018 1:21:25 AM via Trade.
2018-06-29 21:21:25 UTC,crypto_withdrawal,"",Binance (Archived),0.01491246,BTC,97.2297990492,"","","","","","",-3.9226859538,93.3071130954,"","","","",Short term BTC disposal from tax lot of 0.020315150000000 BTC acquired on 6/29/2018 3:18:27 PM via Buy.
2018-06-30 01:07:58 UTC,buy,"",Coinbase,192.33,USD,"",Coinbase,0.03067467,BTC,200.0,7.67,USD,"",192.33,7.67,"","",c433c41f-62e8-5715-9d25-f74b15ad38ed,""
2018-06-30 01:07:58 UTC,fiat_deposit,"","","","","",Coinbase,200.0,USD,"","","","",200.0,"",Visa debit ********9413,"","",Bought Bitcoin Using Visa debit ********9413
2018-06-30 01:08:50 UTC,crypto_withdrawal,"",Coinbase,0.03067467,BTC,200.0,"","","","","","",-8.72,191.28,"","",18RGpbHyakz4oHehDpLTYGRhbrmRqeW9jA,9874e9011c5d7646bcf205189b5faef685576a0307b285f94bbe563bfca1e83e,Sent Bitcoin To Bitcoin address 18RGpbHyakz4oHehDpLTYGRhbrmRqeW9jA
2018-07-11 06:39:43 UTC,crypto_deposit,"","","","","",Binance (Archived),0.00395283,BTC,26.1583907391,"","","",26.1583907391,"","","","",Short term BTC disposal from tax lot of 0.018888920000000 BTC acquired on 7/11/2018 10:39:43 AM via Buy.
2018-07-11 06:39:43 UTC,crypto_deposit,"","","","","",Binance (Archived),0.0046569,BTC,30.8176698297,"","","",30.8176698297,"","","","",Short term BTC disposal from tax lot of 0.018888920000000 BTC acquired on 7/11/2018 10:39:43 AM via Buy.
2018-07-11 06:39:43 UTC,crypto_deposit,"","","","","",Binance (Archived),0.01027919,BTC,68.0239394312,"","","",68.0239394312,"","","","",Short term BTC disposal from tax lot of 0.018888920000000 BTC acquired on 7/11/2018 10:39:43 AM via Buy.
2018-07-11 10:04:56 UTC,crypto_deposit,"","","","","",Binance (Archived),122.877,MIOTA,120.263283333,"","","",120.263283333,"","","","",Short term MIOTA disposal from tax lot of 122.877000000000000 MIOTA acquired on 7/11/2018 2:04:56 PM via Trade.
2018-07-11 10:04:56 UTC,crypto_withdrawal,"",Binance (Archived),0.01505067,BTC,99.599858012,"","","","","","",-3.7638137468,95.8360442652,"","","","",Short term BTC disposal from tax lot of 0.030674670000000 BTC acquired on 6/30/2018 1:07:58 AM via Buy.
2018-07-11 10:04:56 UTC,crypto_withdrawal,"",Binance (Archived),0.00395283,BTC,26.1472078896,"","","","","","",-0.9773256948,25.1698821948,"","","","",Short term BTC disposal from tax lot of 0.018888920000000 BTC acquired on 7/11/2018 10:39:43 AM via Buy.
2018-07-11 10:39:43 UTC,buy,"",Coinbase,120.2,USD,"",Coinbase,0.01888892,BTC,125.0,4.8,USD,"",120.2,4.8,"","",15119af1-7958-5cc6-8ee8-e348372050dd,""
2018-07-11 10:39:43 UTC,fiat_deposit,"","","","","",Coinbase,125.0,USD,"","","","",125.0,"",Visa debit ********9413,"","",Bought Bitcoin Using Visa debit ********9413
2018-07-11 10:41:20 UTC,crypto_withdrawal,"",Coinbase,0.01888892,BTC,125.0,"","","","","","",-5.4,119.6,"","",18RGpbHyakz4oHehDpLTYGRhbrmRqeW9jA,cba5cb0963e7cd871189ff6bf9dcf878c32bab1945d4706c3691bf6b64479b7b,Sent Bitcoin To Bitcoin address 18RGpbHyakz4oHehDpLTYGRhbrmRqeW9jA
2018-07-14 19:47:41 UTC,crypto_deposit,"","","","","",Binance (Archived),0.02325049,BTC,152.0352149295,"","","",152.0352149295,"","","","",Short term BTC disposal from tax lot of 0.038232080000000 BTC acquired on 7/14/2018 11:47:41 PM via Buy.
2018-07-14 19:47:41 UTC,crypto_deposit,"","","","","",Binance (Archived),0.01498159,BTC,97.9647850705,"","","",97.9647850705,"","","","",Short term BTC disposal from tax lot of 0.038232080000000 BTC acquired on 7/14/2018 11:47:41 PM via Buy.
2018-07-14 20:32:14 UTC,crypto_deposit,"","","","","",Binance (Archived),215.784,MIOTA,208.00714464,"","","",208.00714464,"","","","",Short term MIOTA disposal from tax lot of 215.784000000000000 MIOTA acquired on 7/15/2018 12:32:14 AM via Trade.
2018-07-14 20:32:14 UTC,crypto_withdrawal,"",Binance (Archived),0.02325049,BTC,152.0352149294,"","","","","","",-6.6310680625,145.4041468669,"","","","",Short term BTC disposal from tax lot of 0.038232080000000 BTC acquired on 7/14/2018 11:47:41 PM via Buy.
2018-07-14 20:32:14 UTC,crypto_withdrawal,"",Binance (Archived),0.01027919,BTC,67.21573872,"","","","","","",-2.9316375061,64.2841012139,"","","","",Short term BTC disposal from tax lot of 0.018888920000000 BTC acquired on 7/11/2018 10:39:43 AM via Buy.
2018-07-14 20:32:14 UTC,crypto_deposit,"","","","","",Binance (Archived),29.97,MIOTA,28.8898812,"","","",28.8898812,"","","","",Short term MIOTA disposal from tax lot of 29.970000000000000 MIOTA acquired on 7/15/2018 12:32:14 AM via Trade.
2018-07-14 20:32:14 UTC,crypto_withdrawal,"",Binance (Archived),0.0046569,BTC,30.4515213402,"","","","","","",-1.3281535512,29.123367789,"","","","",Short term BTC disposal from tax lot of 0.018888920000000 BTC acquired on 7/11/2018 10:39:43 AM via Buy.
2018-07-14 23:47:41 UTC,fiat_deposit,"","","","","",Coinbase,250.0,USD,"","","","",250.0,"",Visa debit ********9413,"","",Bought Bitcoin Using Visa debit ********9413
2018-07-14 23:47:41 UTC,buy,"",Coinbase,240.41,USD,"",Coinbase,0.03823208,BTC,250.0,9.59,USD,"",240.41,9.59,"","",07a087cf-6c63-593f-9e8a-cf0d8122505a,""
2018-07-17 14:07:51 UTC,crypto_deposit,"","","","","",Binance (Archived),0.00127976,BTC,9.8240972572,"","","",9.8240972572,"","","","",Short term BTC disposal from tax lot of 0.016283430000000 BTC acquired on 7/17/2018 6:07:51 PM via Buy.
2018-07-17 14:07:51 UTC,crypto_deposit,"","","","","",Binance (Archived),0.01500367,BTC,115.1759027429,"","","",115.1759027429,"","","","",Short term BTC disposal from tax lot of 0.016283430000000 BTC acquired on 7/17/2018 6:07:51 PM via Buy.
2018-07-17 14:37:36 UTC,crypto_withdrawal,"",Binance (Archived),0.00127976,BTC,9.8240972572,"","","","","","",-0.4562540572,9.3678432,"","","","",Short term BTC disposal from tax lot of 0.016283430000000 BTC acquired on 7/17/2018 6:07:51 PM via Buy.
2018-07-17 14:37:36 UTC,crypto_deposit,"","","","","",Binance (Archived),104.895,MIOTA,113.80792815,"","","",113.80792815,"","","","",Short term MIOTA disposal from tax lot of 104.895000000000000 MIOTA acquired on 7/17/2018 6:37:36 PM via Trade.
2018-07-17 14:37:36 UTC,crypto_withdrawal,"",Binance (Archived),0.01498159,BTC,115.0064052844,"","","","","","",-5.3411664844,109.6652388,"","","","",Short term BTC disposal from tax lot of 0.038232080000000 BTC acquired on 7/14/2018 11:47:41 PM via Buy.
2018-07-17 18:07:51 UTC,fiat_deposit,"","","","","",Coinbase,125.0,USD,"","","","",125.0,"",Visa debit ********9413,"","",Bought Bitcoin Using Visa debit ********9413
2018-07-17 18:07:51 UTC,buy,"",Coinbase,120.2,USD,"",Coinbase,0.01628343,BTC,125.0,4.8,USD,"",120.2,4.8,"","",f798018a-a022-5b95-9ffe-1e32d93a6eb1,""
2018-07-17 18:10:01 UTC,crypto_withdrawal,"",Coinbase,0.01628343,BTC,125.0,"","","","","","",-4.52,120.48,"","",18RGpbHyakz4oHehDpLTYGRhbrmRqeW9jA,ead3a331d39bbdbc73eec9cee7703514d2cdd4a512a1039369d2708434a28d7a,Sent Bitcoin To Bitcoin address 18RGpbHyakz4oHehDpLTYGRhbrmRqeW9jA
2018-07-18 09:06:52 UTC,crypto_deposit,"","","","","",Binance (Archived),0.0851456,BTC,662.7748911395,"","","",662.7748911395,"","","","",Short term BTC disposal from tax lot of 0.256936710000000 BTC acquired on 7/18/2018 1:06:52 PM via Buy.
2018-07-18 09:06:52 UTC,crypto_deposit,"","","","","",Binance (Archived),0.00316043,BTC,24.6008443091,"","","",24.6008443091,"","","","",Short term BTC disposal from tax lot of 0.256936710000000 BTC acquired on 7/18/2018 1:06:52 PM via Buy.
2018-07-18 09:06:52 UTC,crypto_deposit,"","","","","",Binance (Archived),0.01180295,BTC,91.8743763785,"","","",91.8743763785,"","","","",Short term BTC disposal from tax lot of 0.256936710000000 BTC acquired on 7/18/2018 1:06:52 PM via Buy.
2018-07-18 09:06:52 UTC,crypto_deposit,"","","","","",Binance (Archived),0.0306306,BTC,238.4291446715,"","","",238.4291446715,"","","","",Short term BTC disposal from tax lot of 0.256936710000000 BTC acquired on 7/18/2018 1:06:52 PM via Buy.
2018-07-18 09:06:52 UTC,crypto_deposit,"","","","","",Binance (Archived),0.00492248,BTC,38.316673394,"","","",38.316673394,"","","","",Short term BTC disposal from tax lot of 0.256936710000000 BTC acquired on 7/18/2018 1:06:52 PM via Buy.
2018-07-18 09:06:52 UTC,crypto_deposit,"","","","","",Binance (Archived),0.00013304,BTC,1.0355857674,"","","",1.0355857674,"","","","",Short term BTC disposal from tax lot of 0.256936710000000 BTC acquired on 7/18/2018 1:06:52 PM via Buy.
2018-07-18 09:06:52 UTC,crypto_deposit,"","","","","",Binance (Archived),0.0434928,BTC,338.5487422175,"","","",338.5487422175,"","","","",Short term BTC disposal from tax lot of 0.256936710000000 BTC acquired on 7/18/2018 1:06:52 PM via Buy.
2018-07-18 09:06:52 UTC,crypto_deposit,"","","","","",Binance (Archived),0.0006652,BTC,5.177928837,"","","",5.177928837,"","","","",Short term BTC disposal from tax lot of 0.256936710000000 BTC acquired on 7/18/2018 1:06:52 PM via Buy.
2018-07-18 09:06:52 UTC,crypto_deposit,"","","","","",Binance (Archived),0.0013304,BTC,10.3558576741,"","","",10.3558576741,"","","","",Short term BTC disposal from tax lot of 0.256936710000000 BTC acquired on 7/18/2018 1:06:52 PM via Buy.
2018-07-18 09:06:52 UTC,crypto_deposit,"","","","","",Binance (Archived),0.00425728,BTC,33.138744557,"","","",33.138744557,"","","","",Short term BTC disposal from tax lot of 0.256936710000000 BTC acquired on 7/18/2018 1:06:52 PM via Buy.
2018-07-18 09:06:52 UTC,crypto_deposit,"","","","","",Binance (Archived),0.00827833,BTC,64.4386705193,"","","",64.4386705193,"","","","",Short term BTC disposal from tax lot of 0.256936710000000 BTC acquired on 7/18/2018 1:06:52 PM via Buy.
2018-07-18 09:06:52 UTC,transfer,"",Coinbase,0.0330174,BTC,"",Binance (Archived),0.0330174,BTC,"",0.00521468,BTC,"",239.25,37.7865062058,"",18RGpbHyakz4oHehDpLTYGRhbrmRqeW9jA,8c0e3814cdf15f16530e6186b5865ac875525d72830ec9bce566710a50d2f648,Sent Bitcoin To Bitcoin address 18RGpbHyakz4oHehDpLTYGRhbrmRqeW9jA
2018-07-18 09:06:52 UTC,crypto_deposit,"","","","","",Binance (Archived),0.0301002,BTC,234.3005014737,"","","",234.3005014737,"","","","",Short term BTC disposal from tax lot of 0.256936710000000 BTC acquired on 7/18/2018 1:06:52 PM via Buy.
2018-07-18 13:06:52 UTC,fiat_deposit,"","","","","",Coinbase,2000.0,USD,"","","","",2000.0,"",Visa debit ********9413,"","",Bought Bitcoin Using Visa debit ********9413
2018-07-18 13:06:52 UTC,buy,"",Coinbase,1923.26,USD,"",Coinbase,0.25693671,BTC,2000.0,76.74,USD,"",1923.26,76.74,"","",2e072e18-19f3-51c4-a4cf-fedaa953554e,""
2018-07-18 13:34:27 UTC,crypto_withdrawal,"",Coinbase,0.25693671,BTC,2000.0,"","","","","","",-91.98,1908.02,"","",18RGpbHyakz4oHehDpLTYGRhbrmRqeW9jA,2e5cb64dfd0377b70d891e13d5eabe112786eb0816b6e9e61b1093fa654f57d1,Sent Bitcoin To Bitcoin address 18RGpbHyakz4oHehDpLTYGRhbrmRqeW9jA
2018-07-20 22:09:50 UTC,crypto_withdrawal,"",Binance (Archived),0.00827833,BTC,64.4386705193,"","","","","","",-4.1260694713,60.312601048,"","","","",Short term BTC disposal from tax lot of 0.256936710000000 BTC acquired on 7/18/2018 1:06:52 PM via Buy.
2018-07-20 22:09:50 UTC,crypto_deposit,"","","","","",Binance (Archived),116.8337,MIOTA,118.981103406,"","","",118.981103406,"","","","",Short term MIOTA disposal from tax lot of 174.825000000000000 MIOTA acquired on 7/21/2018 2:09:50 AM via Trade.
2018-07-20 22:09:50 UTC,crypto_deposit,"","","","","",Binance (Archived),57.9913,MIOTA,59.057180094,"","","",59.057180094,"","","","",Short term MIOTA disposal from tax lot of 174.825000000000000 MIOTA acquired on 7/21/2018 2:09:50 AM via Trade.
2018-07-20 22:09:50 UTC,crypto_withdrawal,"",Binance (Archived),0.01500367,BTC,116.7888387767,"","","","","","",-7.4781006247,109.310738152,"","","","",Short term BTC disposal from tax lot of 0.016283430000000 BTC acquired on 7/17/2018 6:07:51 PM via Buy.
2018-07-20 22:10:18 UTC,crypto_withdrawal,"",Binance (Archived),0.00425728,BTC,33.138744557,"","","","","","",-2.1074732098,31.0312713472,"","","","",Short term BTC disposal from tax lot of 0.256936710000000 BTC acquired on 7/18/2018 1:06:52 PM via Buy.
2018-07-20 22:10:18 UTC,crypto_deposit,"","","","","",Binance (Archived),7.1663,MIOTA,7.298016594,"","","",7.298016594,"","","","",Short term MIOTA disposal from tax lot of 32.000000000000000 MIOTA acquired on 7/21/2018 2:10:18 AM via Trade.
2018-07-20 22:10:18 UTC,crypto_deposit,"","","","","",Binance (Archived),0.0019345,BNB,0.0249250653,"","","",0.0249250653,"","","","",Short term BNB disposal from tax lot of 0 BNB acquired on 7/21/2018 2:10:18 AM via Reconciliation Event.
2018-07-20 22:10:18 UTC,crypto_deposit,"","","","","",Binance (Archived),24.8337,MIOTA,25.290143406,"","","",25.290143406,"","","","",Short term MIOTA disposal from tax lot of 32.000000000000000 MIOTA acquired on 7/21/2018 2:10:18 AM via Trade.
2018-07-20 22:10:18 UTC,crypto_withdrawal,"",Binance (Archived),0.0019345,BNB,0.0249250653,"","","","","","","",0.0249250653,"","","","",Short term BNB disposal from tax lot of 0 BNB acquired on 7/21/2018 2:10:18 AM via Reconciliation Event.
2018-07-20 22:10:24 UTC,crypto_withdrawal,"",Binance (Archived),0.00060447,BNB,0.0077882937,"","","","","","","",0.0077882937,"","","","",Short term BNB disposal from tax lot of 0 BNB acquired on 7/21/2018 2:10:24 AM via Reconciliation Event.
2018-07-20 22:10:24 UTC,crypto_deposit,"","","","","",Binance (Archived),10.0,MIOTA,10.1838,"","","",10.1838,"","","","",Short term MIOTA disposal from tax lot of 10.000000000000000 MIOTA acquired on 7/21/2018 2:10:24 AM via Trade.
2018-07-20 22:10:24 UTC,crypto_deposit,"","","","","",Binance (Archived),0.00060447,BNB,0.0077882937,"","","",0.0077882937,"","","","",Short term BNB disposal from tax lot of 0 BNB acquired on 7/21/2018 2:10:24 AM via Reconciliation Event.
2018-07-20 22:10:24 UTC,crypto_withdrawal,"",Binance (Archived),0.0013304,BTC,10.3558576741,"","","","","","",-0.6585853781,9.697272296,"","","","",Short term BTC disposal from tax lot of 0.256936710000000 BTC acquired on 7/18/2018 1:06:52 PM via Buy.
2018-07-20 22:10:38 UTC,crypto_deposit,"","","","","",Binance (Archived),5.0,MIOTA,5.0919,"","","",5.0919,"","","","",Short term MIOTA disposal from tax lot of 5.000000000000000 MIOTA acquired on 7/21/2018 2:10:38 AM via Trade.
2018-07-20 22:10:38 UTC,crypto_withdrawal,"",Binance (Archived),0.0006652,BTC,5.177928837,"","","","","","",-0.329292689,4.848636148,"","","","",Short term BTC disposal from tax lot of 0.256936710000000 BTC acquired on 7/18/2018 1:06:52 PM via Buy.
2018-07-20 22:10:38 UTC,crypto_withdrawal,"",Binance (Archived),0.00030237,BNB,0.0038958863,"","","","","","","",0.0038958863,"","","","",Short term BNB disposal from tax lot of 0 BNB acquired on 7/21/2018 2:10:38 AM via Reconciliation Event.
2018-07-20 22:10:38 UTC,crypto_deposit,"","","","","",Binance (Archived),0.00030237,BNB,0.0038958863,"","","",0.0038958863,"","","","",Short term BNB disposal from tax lot of 0 BNB acquired on 7/21/2018 2:10:38 AM via Reconciliation Event.
2018-07-20 22:10:51 UTC,crypto_deposit,"","","","","",Binance (Archived),639.36,MIOTA,651.1114368,"","","",651.1114368,"","","","",Short term MIOTA disposal from tax lot of 639.360000000000000 MIOTA acquired on 7/21/2018 2:10:51 AM via Trade.
2018-07-20 22:10:51 UTC,crypto_withdrawal,"",Binance (Archived),0.0851456,BTC,703.3660546209,"","","","","","",-82.7406276769,620.625426944,"","","","",Short term BTC disposal from tax lot of 0.256936710000000 BTC acquired on 7/18/2018 1:06:52 PM via Buy.
2018-07-20 22:11:39 UTC,crypto_deposit,"","","","","",Binance (Archived),0.00006054,BNB,0.0007800276,"","","",0.0007800276,"","","","",Short term BNB disposal from tax lot of 0 BNB acquired on 7/21/2018 2:11:39 AM via Reconciliation Event.
2018-07-20 22:11:39 UTC,crypto_deposit,"","","","","",Binance (Archived),1.0,MIOTA,1.01838,"","","",1.01838,"","","","",Short term MIOTA disposal from tax lot of 1.000000000000000 MIOTA acquired on 7/21/2018 2:11:39 AM via Trade.
2018-07-20 22:11:39 UTC,crypto_withdrawal,"",Binance (Archived),0.00013304,BTC,1.0355857674,"","","","","","",-0.0658838154,0.969701952,"","","","",Short term BTC disposal from tax lot of 0.256936710000000 BTC acquired on 7/18/2018 1:06:52 PM via Buy.
2018-07-20 22:11:39 UTC,crypto_withdrawal,"",Binance (Archived),0.0000605,BNB,0.0007795122,"","","","","","",0.0000000001,0.0007795123,"","","","",Short term BNB disposal from tax lot of 0 BNB acquired on 7/21/2018 2:11:39 AM via Reconciliation Event.
2018-07-20 22:11:51 UTC,crypto_withdrawal,"",Binance (Archived),0.00492248,BTC,38.316673394,"","","","","","",-2.43770117,35.878972224,"","","","",Short term BTC disposal from tax lot of 0.256936710000000 BTC acquired on 7/18/2018 1:06:52 PM via Buy.
2018-07-20 22:11:51 UTC,crypto_deposit,"","","","","",Binance (Archived),36.963,MIOTA,37.64237994,"","","",37.64237994,"","","","",Short term MIOTA disposal from tax lot of 36.963000000000000 MIOTA acquired on 7/21/2018 2:11:51 AM via Trade.
2018-07-21 00:19:25 UTC,crypto_deposit,"","","","","",Binance (Archived),1.0,MIOTA,1.01838,"","","",1.01838,"","","","",Short term MIOTA disposal from tax lot of 230.769000000000000 MIOTA acquired on 7/21/2018 4:19:25 AM via Trade.
2018-07-21 00:19:25 UTC,crypto_deposit,"","","","","",Binance (Archived),24.0,MIOTA,24.44112,"","","",24.44112,"","","","",Short term MIOTA disposal from tax lot of 230.769000000000000 MIOTA acquired on 7/21/2018 4:19:25 AM via Trade.
2018-07-21 00:19:25 UTC,crypto_deposit,"","","","","",Binance (Archived),1.0,MIOTA,1.01838,"","","",1.01838,"","","","",Short term MIOTA disposal from tax lot of 230.769000000000000 MIOTA acquired on 7/21/2018 4:19:25 AM via Trade.
2018-07-21 00:19:25 UTC,crypto_deposit,"","","","","",Binance (Archived),38.9257,MIOTA,39.641154366,"","","",39.641154366,"","","","",Short term MIOTA disposal from tax lot of 230.769000000000000 MIOTA acquired on 7/21/2018 4:19:25 AM via Trade.
2018-07-21 00:19:25 UTC,crypto_deposit,"","","","","",Binance (Archived),163.8433,MIOTA,166.854739854,"","","",166.854739854,"","","","",Short term MIOTA disposal from tax lot of 230.769000000000000 MIOTA acquired on 7/21/2018 4:19:25 AM via Trade.
2018-07-21 00:19:25 UTC,crypto_withdrawal,"",Binance (Archived),0.0306306,BTC,238.4291446715,"","","","","","",-15.4098902135,223.019254458,"","","","",Short term BTC disposal from tax lot of 0.256936710000000 BTC acquired on 7/18/2018 1:06:52 PM via Buy.
2018-07-21 00:19:25 UTC,crypto_deposit,"","","","","",Binance (Archived),1.0,MIOTA,1.01838,"","","",1.01838,"","","","",Short term MIOTA disposal from tax lot of 230.769000000000000 MIOTA acquired on 7/21/2018 4:19:25 AM via Trade.
2018-07-21 00:19:25 UTC,crypto_deposit,"","","","","",Binance (Archived),1.0,MIOTA,1.01838,"","","",1.01838,"","","","",Short term MIOTA disposal from tax lot of 230.769000000000000 MIOTA acquired on 7/21/2018 4:19:25 AM via Trade.
2018-07-21 00:19:31 UTC,crypto_deposit,"","","","","",Binance (Archived),155.6767,MIOTA,158.538037746,"","","",158.538037746,"","","","",Short term MIOTA disposal from tax lot of 248.751000000000000 MIOTA acquired on 7/21/2018 4:19:31 AM via Trade.
2018-07-21 00:19:31 UTC,crypto_withdrawal,"",Binance (Archived),0.0330174,BTC,257.0080390615,"","","","","","",-16.6106608795,240.397378182,"","","","",Short term BTC disposal from tax lot of 0.256936710000000 BTC acquired on 7/18/2018 1:06:52 PM via Buy.
2018-07-21 00:19:31 UTC,crypto_withdrawal,"",Binance (Archived),0.0301002,BTC,234.3005014737,"","","","","","",-15.1430522877,219.157449186,"","","","",Short term BTC disposal from tax lot of 0.256936710000000 BTC acquired on 7/18/2018 1:06:52 PM via Buy.
2018-07-21 00:19:31 UTC,crypto_deposit,"","","","","",Binance (Archived),226.773,MIOTA,230.94108774,"","","",230.94108774,"","","","",Short term MIOTA disposal from tax lot of 226.773000000000000 MIOTA acquired on 7/21/2018 4:19:31 AM via Trade.
2018-07-21 00:19:31 UTC,crypto_deposit,"","","","","",Binance (Archived),1.0,MIOTA,1.01838,"","","",1.01838,"","","","",Short term MIOTA disposal from tax lot of 248.751000000000000 MIOTA acquired on 7/21/2018 4:19:31 AM via Trade.
2018-07-21 00:19:31 UTC,crypto_deposit,"","","","","",Binance (Archived),66.0,MIOTA,67.21308,"","","",67.21308,"","","","",Short term MIOTA disposal from tax lot of 248.751000000000000 MIOTA acquired on 7/21/2018 4:19:31 AM via Trade.
2018-07-21 00:19:31 UTC,crypto_deposit,"","","","","",Binance (Archived),26.0743,MIOTA,26.553545634,"","","",26.553545634,"","","","",Short term MIOTA disposal from tax lot of 248.751000000000000 MIOTA acquired on 7/21/2018 4:19:31 AM via Trade.
2018-07-21 00:19:33 UTC,crypto_deposit,"","","","","",Binance (Archived),327.672,MIOTA,333.69461136,"","","",333.69461136,"","","","",Short term MIOTA disposal from tax lot of 327.672000000000000 MIOTA acquired on 7/21/2018 4:19:33 AM via Trade.
2018-07-21 00:19:33 UTC,crypto_withdrawal,"",Binance (Archived),0.0434928,BTC,290.9244944383,"","","","","","",25.7435378657,316.668032304,"","","","",Short term BTC disposal from tax lot of 0.256936710000000 BTC acquired on 7/18/2018 1:06:52 PM via Buy.
2018-07-21 09:28:39 UTC,crypto_deposit,"","","","","",Binance (Archived),0.00317819,BTC,25.0,"","","",25.0,"","","","",Short term BTC disposal from tax lot of 0.003178190000000 BTC acquired on 7/21/2018 1:28:39 PM via Buy.
2018-07-21 10:40:53 UTC,crypto_withdrawal,"",Binance (Archived),0.00316043,BTC,24.8602978425,"","","","","","",-1.5993118124,23.2609860301,"","","","",Short term BTC disposal from tax lot of 0.256936710000000 BTC acquired on 7/18/2018 1:06:52 PM via Buy.
2018-07-21 10:40:53 UTC,crypto_deposit,"","","","","",Binance (Archived),22.977,MIOTA,22.483591902,"","","",22.483591902,"","","","",Short term MIOTA disposal from tax lot of 22.977000000000000 MIOTA acquired on 7/21/2018 2:40:53 PM via Trade.
2018-07-21 13:28:39 UTC,buy,"",Coinbase,23.51,USD,"",Coinbase,0.00317819,BTC,25.0,1.49,USD,"",23.51,1.49,"","",fd127598-8560-5c68-92cd-fe28c806411d,""
2018-07-21 13:28:39 UTC,fiat_deposit,"","","","","",Coinbase,25.0,USD,"","","","",25.0,"",Visa debit ********9413,"","",Bought Bitcoin Using Visa debit ********9413
2018-07-21 13:29:47 UTC,crypto_withdrawal,"",Coinbase,0.00317819,BTC,25.0,"","","","","","",-1.6,23.4,"","",18RGpbHyakz4oHehDpLTYGRhbrmRqeW9jA,5f1d7bc8d4c095998f31a3213c79d9aca60300da220fe06dfa35cbb3fd91f03d,Sent Bitcoin To Bitcoin address 18RGpbHyakz4oHehDpLTYGRhbrmRqeW9jA
2018-07-22 13:15:35 UTC,crypto_deposit,"","","","","",Binance (Archived),0.0009629,BTC,7.543674814,"","","",7.543674814,"","","","",Short term BTC disposal from tax lot of 0.015955420000000 BTC acquired on 7/22/2018 5:15:35 PM via Buy.
2018-07-22 13:15:35 UTC,crypto_deposit,"","","","","",Binance (Archived),0.00448136,BTC,35.1084459074,"","","",35.1084459074,"","","","",Short term BTC disposal from tax lot of 0.015955420000000 BTC acquired on 7/22/2018 5:15:35 PM via Buy.
2018-07-22 13:15:35 UTC,crypto_deposit,"","","","","",Binance (Archived),0.0019866,BTC,15.5636767945,"","","",15.5636767945,"","","","",Short term BTC disposal from tax lot of 0.015955420000000 BTC acquired on 7/22/2018 5:15:35 PM via Buy.
2018-07-22 13:15:35 UTC,crypto_deposit,"","","","","",Binance (Archived),0.00852456,BTC,66.7842024842,"","","",66.7842024842,"","","","",Short term BTC disposal from tax lot of 0.015955420000000 BTC acquired on 7/22/2018 5:15:35 PM via Buy.
